Links,Tags,Likes,Comments
https://cdn.pixabay.com/photo/2016/04/15/21/39/paper-1332019__340.jpg,Handmade Paper Gray White Laid,490,98
https://cdn.pixabay.com/photo/2021/03/04/07/31/mountains-6067150__340.jpg,Mountains Reflection Lake Fjord,152,25
https://cdn.pixabay.com/photo/2022/03/27/15/16/seedling-7095397__340.jpg,Flower Bloom Buds Seedling Blossoms,7,4
https://cdn.pixabay.com/photo/2017/09/04/18/39/coffee-2714970__340.jpg,Beans Drink Coffee Cup,771,127
https://cdn.pixabay.com/photo/2022/03/24/08/28/animal-7088594__340.jpg,Lebensfreude,14,12
https://cdn.pixabay.com/photo/2022/04/04/13/54/city-7111375__480.jpg,Seoul Landscape Sundown Sunset City,2,0
https://cdn.pixabay.com/photo/2021/10/13/15/43/boy-6706970__340.jpg,Boy Shelter House Child Kid,34,11
https://cdn.pixabay.com/photo/2022/02/24/21/04/flower-7033155__340.jpg,Blossom Flower Bloom Botany Petals,48,46
https://cdn.pixabay.com/photo/2018/02/15/10/14/sky-3154857__340.jpg,Heaven Snow Sculpture Statue Travel,531,144
https://cdn.pixabay.com/photo/2022/04/01/18/43/bird-7105454__340.jpg,Bird Black-Headed Ornithology Gull,1,0
https://cdn.pixabay.com/photo/2016/11/29/08/51/city-1868530__340.jpg,Alone Person Solo Window City Man,652,100
https://cdn.pixabay.com/photo/2020/01/27/10/24/pollution-4796858__340.jpg,Drone Pollution Environment Aerial,76,19
https://cdn.pixabay.com/photo/2019/07/25/06/51/thuja-4361821__340.jpg,Drops Thuja Summer Water Plant,167,37
https://cdn.pixabay.com/photo/2019/11/11/15/32/coffee-4618705__340.jpg,Espresso Caffeine Coffee Cup,179,35
https://cdn.pixabay.com/photo/2018/06/30/17/02/model-3508004__340.jpg,Model Lingerie Portrait Sexy Lying,446,24
https://cdn.pixabay.com/photo/2022/03/31/11/05/lime-butterfly-7102782__340.jpg,Insect Butterfly Wings Lime,2,0
https://cdn.pixabay.com/photo/2020/01/01/14/59/person-4733756__340.jpg,Person Sunset Boy Twilight Man,88,30
https://cdn.pixabay.com/photo/2022/02/15/09/53/cosmetics-7014585__340.jpg,Makeup Brushes Cosmetics,5,1
https://cdn.pixabay.com/photo/2018/03/13/02/43/eye-3221498__340.jpg,Eyeball Iris Pupil Vision Eye,647,100
https://cdn.pixabay.com/photo/2017/05/10/15/05/himalayas-2301040__340.jpg,Sky Clouds Himalayas Mountains Stars,525,71
https://cdn.pixabay.com/photo/2014/09/24/14/29/macbook-459196__480.jpg,Display Screen Laptop Macbook Google,701,198
https://cdn.pixabay.com/photo/2018/12/04/22/38/road-3856796__340.jpg,Clouds Landscape Bird Road Nevada,524,104
https://cdn.pixabay.com/photo/2020/12/14/17/40/studying-5831644__340.jpg,Students Teacher Sunset Studying,80,24
https://cdn.pixabay.com/photo/2014/08/11/11/50/moon-415501__340.jpg,Night Full Moon Lunar Dark,998,173
https://cdn.pixabay.com/photo/2020/06/02/04/13/nude-5249289__340.jpg,Model Girl Body Nude Erotic Naked,224,11
https://cdn.pixabay.com/photo/2018/10/10/14/35/picture-frame-3737438__340.jpg,Flower Frame Orchid Picture,339,76
https://cdn.pixabay.com/photo/2022/03/26/16/04/bird-7093163__340.jpg,Bird Kookaburra Ornithology Laughing,17,12
https://cdn.pixabay.com/photo/2022/02/07/21/01/boat-7000270__340.jpg,Shipwreck Wreck Boat Abandoned,18,6
https://cdn.pixabay.com/photo/2022/03/18/13/13/sunset-7076676__340.jpg,Nature Dusk Outdoors Sunset Travel,4,3
https://cdn.pixabay.com/photo/2022/02/26/05/13/green-veined-white-butterfly-7035225__340.jpg,White Butterfly Green-Veined,48,42
https://cdn.pixabay.com/photo/2021/05/25/12/59/mountain-6282389__340.jpg,Mountain Forest Trees Sky Road Sea,145,82
https://cdn.pixabay.com/photo/2022/04/02/13/15/snail-7106991__340.jpg,Species Snail Invasive Plants,8,1
https://cdn.pixabay.com/photo/2021/04/19/11/14/snail-6191155__340.jpg,Snail Mollusk Shell,114,23
https://cdn.pixabay.com/photo/2022/04/04/05/59/cross-7110417__340.jpg,(optional) description a Add,10,3
https://cdn.pixabay.com/photo/2022/03/27/10/22/city-7094641__480.jpg,Frankfurt City Germany Skyscrapers,4,0
https://cdn.pixabay.com/photo/2019/12/26/11/04/golden-4720210__340.jpg,Golden Sylvester Background,213,61
https://cdn.pixabay.com/photo/2016/10/12/02/56/girl-1733352__340.jpg,Girl Owner Dog Sleep Down Lying Pet,969,119
https://cdn.pixabay.com/photo/2018/02/04/13/51/night-3129908__340.jpg,Night Castle Fantasy Crow Cloud,497,45
https://cdn.pixabay.com/photo/2022/01/11/16/16/forest-6930996__340.jpg,Forest Nature Trees Snow Fog Winter,68,66
https://cdn.pixabay.com/photo/2017/08/07/07/48/couple-2601156__340.jpg,People Outdoors Hugging Grass Couple,496,65
https://cdn.pixabay.com/photo/2019/03/12/20/27/kanban-4051777__340.jpg,Kanban Organize To Process Work,384,74
https://cdn.pixabay.com/photo/2022/04/07/16/36/art-7117921__340.jpg,Paint Stars Metaverse Nft Scene Art,3,0
https://cdn.pixabay.com/photo/2021/08/25/16/33/animal-6573941__340.jpg,Species Mammal Squirrel Animal,75,44
https://cdn.pixabay.com/photo/2022/04/04/09/54/butterfly-7110774__340.jpg,Insect Butterfly Polyenidae Nature,2,0
https://cdn.pixabay.com/photo/2021/11/10/20/03/microphone-6784742__340.jpg,Microphone Mic Sound Audio Music,11,1
https://cdn.pixabay.com/photo/2020/10/04/09/57/bird-feather-5625806__340.jpg,Bird Plume Lightness Feather,201,42
https://cdn.pixabay.com/photo/2022/02/23/15/45/portrait-7030878__340.jpg,Model Shirt Beauty Portrait Yellow,5,3
https://cdn.pixabay.com/photo/2022/03/10/18/41/gull-7060518__480.jpg,Animal Wings Bird Flying Gull,28,32
https://cdn.pixabay.com/photo/2022/04/02/10/32/sea-7106683__340.jpg,Etangs Corsica d&#39;Asciaghju - Porto-Vecchio,2,0
https://cdn.pixabay.com/photo/2021/08/27/08/21/video-game-6578106__340.jpg,Video Entertainment Boy Game,18,7
https://cdn.pixabay.com/photo/2021/01/07/14/19/vaccine-5897391__340.jpg,Vaccine Medicine Covid-19 Cure Virus,44,12
https://cdn.pixabay.com/photo/2022/04/07/16/08/moon-7117836__340.jpg,Night Sky Full Moon Astronomy,1,0
https://cdn.pixabay.com/photo/2022/01/14/23/06/yachts-6938309__340.jpg,Yachts Sunset Boats Wharf Marine,85,83
https://cdn.pixabay.com/photo/2022/03/27/13/11/map-7095042__340.jpg,Map Wallpaper Of Brazil,1,0
https://cdn.pixabay.com/photo/2022/03/13/14/28/sofa-7066157__340.jpg,Table Interior Book Sofa Living Room,5,1
https://cdn.pixabay.com/photo/2017/04/07/21/22/waves-2211925__340.jpg,Waves Sea Ocean Smashing,864,98
https://cdn.pixabay.com/photo/2022/02/26/15/04/mushrooms-7035893__340.jpg,Nature Mushrooms Fungus Mycology,24,22
https://cdn.pixabay.com/photo/2019/09/23/04/50/jellyfish-4497496__340.jpg,Medusa Jellyfish Sea Lilac Jelly,141,14
https://cdn.pixabay.com/photo/2022/01/30/13/13/astronomy-6980859__340.jpg,Sky Night Astronomy Evening,12,0
https://cdn.pixabay.com/photo/2021/08/11/03/19/incense-sticks-6537296__340.jpg,Incense Drying Yen Hung Sticks,42,9
https://cdn.pixabay.com/photo/2021/09/02/13/36/pizza-6593504__340.jpg,Wood Pizza Fired,72,61
https://cdn.pixabay.com/photo/2022/04/06/01/38/city-7114646__340.jpg,Tower Buildings City Tourism Travel,2,0
https://cdn.pixabay.com/photo/2021/12/16/05/59/trees-6873797__340.jpg,Forest Trees Snow Winter Cold,84,78
https://cdn.pixabay.com/photo/2022/02/09/17/53/salad-7003903__480.jpg,Lamb'S Salad Corn Lettuce,45,39
https://cdn.pixabay.com/photo/2014/11/13/23/34/palace-530055__340.jpg,Big Ben London Parliament Palace,872,100
https://cdn.pixabay.com/photo/2019/11/22/18/41/christmas-4645449__340.jpg,Christmas Gifts Surprise Present,266,71
https://cdn.pixabay.com/photo/2020/10/04/16/07/typewriter-5626841__340.jpg,Retro Typewriter Antique Vintage Old,249,91
https://cdn.pixabay.com/photo/2022/01/31/09/08/nature-6983033__340.jpg,Valley Nature Travel Exploration,42,54
https://cdn.pixabay.com/photo/2021/08/04/10/19/chess-6521465__340.jpg,Crown King Pawn Chess Strategic,10,4
https://cdn.pixabay.com/photo/2016/11/29/01/51/wood-1866654__340.jpg,Board Background Backdrop Floor Wood,321,64
https://cdn.pixabay.com/photo/2017/12/12/11/37/bastei-3014467__340.jpg,Bridge Rock Formation Bastei,603,64
https://cdn.pixabay.com/photo/2022/03/30/10/02/roses-7100907__340.jpg,Flower Pink Flowers Roses Petals,3,0
https://cdn.pixabay.com/photo/2022/04/01/14/51/melon-flowers-7104988__340.jpg,Flowers Blossoms Melon,0,0
https://cdn.pixabay.com/photo/2022/03/28/02/37/swan-7096428__340.jpg,River Lake Bird Swan Black,11,14
https://cdn.pixabay.com/photo/2021/08/04/15/45/waterfall-6522033__340.jpg,Exploration Outdoors Nature Waterfall,109,21
https://cdn.pixabay.com/photo/2022/03/29/16/28/animal-7099734__340.jpg,Mammal Animal Stray Cat Feline Pet,6,1
https://cdn.pixabay.com/photo/2022/03/14/12/37/storks-nest-7068127__340.jpg,Stork'S Build Stork Nest Bird,18,15
https://cdn.pixabay.com/photo/2022/04/08/15/18/homeless-7119684__480.jpg,Street Homeless Monochrome Beggar,0,0
https://cdn.pixabay.com/photo/2015/03/11/12/31/buildings-668616__340.jpg,Buildings City Cityscape River,766,174
https://cdn.pixabay.com/photo/2022/01/23/21/04/friendship-6961952__340.jpg,Animal Dog Crow Bird Man Friendship,25,14
https://cdn.pixabay.com/photo/2021/08/30/21/48/ferris-wheel-6587185__340.jpg,Amusement Ferris Park Ride Wheel,21,8
https://cdn.pixabay.com/photo/2022/03/25/08/04/wallflower-7090453__340.jpg,Flower Wallflower Buds,17,15
https://cdn.pixabay.com/photo/2022/04/06/11/51/tulip-7115419__340.jpg,Flower Red Tulip Petals,4,2
https://cdn.pixabay.com/photo/2022/02/27/23/40/stealth-7038292__340.jpg,Stealth Bombers Aircraft,33,50
https://cdn.pixabay.com/photo/2022/04/04/13/18/winter-7111243__340.jpg,Winter Mountains Nature Poland,1,0
https://cdn.pixabay.com/photo/2016/11/13/21/46/sheep-1822137__340.jpg,Animal Curious Look Farm Sheep,724,116
https://cdn.pixabay.com/photo/2022/02/24/13/28/flower-7032454__340.jpg,Flower Insect Bee Pollination,40,55
https://cdn.pixabay.com/photo/2022/03/27/17/07/flowers-7095657__340.jpg,Blossom Tulips Bloom Flowers Botany,9,4
https://cdn.pixabay.com/photo/2016/11/22/20/02/abstract-1850417__340.jpg,Background Abstract Art Backdrop,620,90
https://cdn.pixabay.com/photo/2021/06/26/08/49/lighthouse-6365680__340.jpg,Ocean Tower Island Lighthouse Sea,58,15
https://cdn.pixabay.com/photo/2022/01/09/13/52/nature-6926016__340.jpg,Ruht in sich…. Seit Jahrhunderten,49,34
https://cdn.pixabay.com/photo/2021/09/15/12/45/soap-bubble-6626763__480.jpg,Reflection Bubble Soap,96,71
https://cdn.pixabay.com/photo/2022/04/02/03/38/snake-7106262__340.jpg,Snake Ribbon Reptile Wildlife,1,0
https://cdn.pixabay.com/photo/2020/08/30/09/28/buildings-5528981__340.jpg,Rain Houses Buildings City Street,227,36
https://cdn.pixabay.com/photo/2021/06/04/15/10/sand-6310117__340.jpg,Sandy Sand Beach Shore,71,16
https://cdn.pixabay.com/photo/2019/02/11/14/38/mountain-3989829__340.jpg,Mountain Night Aurora Moon,288,43
https://cdn.pixabay.com/photo/2022/04/01/08/41/bumblebee-7104355__340.jpg,Marigold Bumblebee Flora Pollination,5,3
https://cdn.pixabay.com/photo/2022/03/21/14/15/mallards-7083290__340.jpg,Male Ducks Bird Mallards Female,19,22
https://cdn.pixabay.com/photo/2017/01/07/17/48/interior-1961070__340.jpg,Interior Room Furniture Living,450,79
https://cdn.pixabay.com/photo/2017/09/30/22/16/rail-2803725__340.jpg,Imagination Composing Girl Rail,1124,138
https://cdn.pixabay.com/photo/2021/02/08/09/57/canvas-5994251__340.jpg,Square Template Canvas Blank Frame,42,5
https://cdn.pixabay.com/photo/2021/10/25/07/39/christmas-6740123__340.jpg,Holiday Christmas Window Winter,27,5
https://cdn.pixabay.com/photo/2017/07/20/15/21/chickens-2522623__340.jpg,Chickens Hen Rooster Birds Poultry,546,99
https://cdn.pixabay.com/photo/2021/02/17/12/04/winter-6024017__340.jpg,People Tree Animal Dog Winter Walk,158,61
https://cdn.pixabay.com/photo/2021/09/27/16/03/cave-6661442__340.jpg,Sand Rocks Coast Beach Cave Sea,22,4
https://cdn.pixabay.com/photo/2020/06/26/23/24/butterfly-5344157__480.jpg,Butterfly Paper Colorful Window Art,173,20
https://cdn.pixabay.com/photo/2014/07/28/20/39/sunset-404072__340.jpg,daytime snow during covered trees,1148,439
https://cdn.pixabay.com/photo/2019/04/22/03/38/marble-4145542__340.jpg,Background White Marble Paradigm,124,30
https://cdn.pixabay.com/photo/2016/12/06/14/33/log-cabin-1886620__340.jpg,Cabin Home Finland Cottage House Log,563,79
https://cdn.pixabay.com/photo/2021/11/20/14/22/renewable-6811970__340.jpg,Energy Renewable Roof Solar,6,0
https://cdn.pixabay.com/photo/2022/03/23/15/51/minaret-7087456__340.jpg,Turkey Dome Minaret Architecture,14,17
https://cdn.pixabay.com/photo/2022/03/08/14/15/flower-7055828__340.jpg,Blossom Flower Bloom Botany Crocus,22,8
https://cdn.pixabay.com/photo/2017/10/29/15/58/trees-2900064__340.jpg,Fence Trees Farm Farmland,590,92
https://cdn.pixabay.com/photo/2022/04/04/20/34/winter-7112373__340.jpg,Meadow Snow Barn Countryside Winter,2,1
https://cdn.pixabay.com/photo/2022/02/08/21/52/nutria-7002216__340.jpg,Küssen Liebe Valentinstag Valentin,39,47
https://cdn.pixabay.com/photo/2019/12/02/10/34/digitization-4667376__340.jpg,Man Transformation Digitization Hand,104,21
https://cdn.pixabay.com/photo/2022/01/28/19/24/clouds-6975649__340.jpg,Mountain Nature Sky Clouds Cumulus,55,49
https://cdn.pixabay.com/photo/2022/03/28/08/07/duck-7096902__340.jpg,Plumage Swim Bird Garganey Duck,7,7
https://cdn.pixabay.com/photo/2021/11/26/17/26/landscapre-desert-safari-6826296__340.jpg,Safari Landscapre Desert,9,1
https://cdn.pixabay.com/photo/2020/08/04/09/32/fear-5462288__340.jpg,Scared Fear Emotions Sadness Anxiety,62,19
https://cdn.pixabay.com/photo/2022/03/31/12/30/persimmon-7102910__480.jpg,Fruits Sliced Persimmon,4,0
https://cdn.pixabay.com/photo/2022/03/09/07/30/butterfly-7057257__340.jpg,Insect Butterfly Flower,28,26
https://cdn.pixabay.com/photo/2022/02/28/08/15/geometric-shapes-7038730__340.jpg,Shapes Geometric Render Objects,6,1
https://cdn.pixabay.com/photo/2016/11/29/06/20/blonde-1867768__340.jpg,Wall Buildings City Blonde Sitting,563,76
https://cdn.pixabay.com/photo/2022/04/02/17/19/flowers-7107430__340.jpg,Meadow Early Morning Flowers Grass,5,3
https://cdn.pixabay.com/photo/2022/04/12/02/04/bird-7126999__340.jpg,Ornithology Bird Grey Species Heron,0,0
https://cdn.pixabay.com/photo/2022/04/11/18/05/balmedie-beach-7126344__340.jpg,Balmedie Sand Dunes Grass Beach,1,0
https://cdn.pixabay.com/photo/2022/03/29/17/55/shoes-7099877__340.jpg,Leather Footwear Shoes Style Fashion,2,0
https://cdn.pixabay.com/photo/2020/10/03/09/05/solar-energy-5622969__340.jpg,Power Panels Energy Solar,28,11
https://cdn.pixabay.com/photo/2021/12/16/11/08/mount-fuji-6874364__340.jpg,spots this mountain. Fuji mountain which slightly upper in Before was overwhelmed Mt. by I country. from our Mitsutouge-sanso famous scene. (3776m) took hut of highest part is sunrise the one viewing majestic photo illuminated.,36,29
https://cdn.pixabay.com/photo/2022/04/03/14/30/plant-7109103__340.jpg,Nature Up Plant Close Berries Fruits,3,0
https://cdn.pixabay.com/photo/2014/12/21/07/49/fireworks-574739__340.jpg,New Eve Year'S Fireworks Pyrotechnics,839,150
https://cdn.pixabay.com/photo/2020/09/10/15/23/sunset-5560658__340.jpg,Volleyball Sunset Beach Silhouette,178,36
https://cdn.pixabay.com/photo/2022/03/06/20/34/filled-snowdrops-7052503__340.jpg,Filled Spring Snowdrops Snowdrop,31,26
https://cdn.pixabay.com/photo/2021/12/12/14/17/mountains-6865262__340.jpg,Tundra Mountains Snow,19,1
https://cdn.pixabay.com/photo/2020/12/08/14/27/winter-5814578__340.jpg,Street Winter Forest Car,115,23
https://cdn.pixabay.com/photo/2022/01/30/21/50/stones-6982366__480.jpg,Balance Tower Stones Stone Zen,6,1
https://cdn.pixabay.com/photo/2022/03/25/08/23/heron-7090468__340.jpg,Avian Nature River Waterfowl Heron,13,8
https://cdn.pixabay.com/photo/2016/11/22/22/25/abs-1850926__340.jpg,Abs Blonde Athlete Body Biceps Fit,237,19
https://cdn.pixabay.com/photo/2018/11/08/23/52/man-3803551__340.jpg,People Person Coffee Drink Tea Man,296,73
https://cdn.pixabay.com/photo/2020/01/25/10/36/ferris-wheel-4792152__340.jpg,U Ferris E Dubai Landscape A Wheel,200,85
https://cdn.pixabay.com/photo/2021/06/10/17/57/bumblebee-6326653__340.jpg,Insect Hovering Bumblebee Nectar,74,26
https://cdn.pixabay.com/photo/2022/03/22/16/25/man-7085420__340.jpg,Break Man Dance Dancer,7,3
https://cdn.pixabay.com/photo/2016/11/18/19/07/happy-1836445__340.jpg,Face City Guy Man Happy Adult,392,59
https://cdn.pixabay.com/photo/2022/01/26/21/51/tulip-6970027__340.jpg,Flower Tulip Pink Blossom,52,54
https://cdn.pixabay.com/photo/2022/02/03/20/52/music-6991348__340.jpg,Score Sheet Notes Music,35,41
https://cdn.pixabay.com/photo/2022/02/20/12/32/cat-7024449__340.jpg,Pattern Background Cat Fishbones Pet,6,2
https://cdn.pixabay.com/photo/2020/09/23/02/01/microphone-5594702__340.jpg,Microphone Equipment Voice Sound,156,31
https://cdn.pixabay.com/photo/2022/03/23/21/08/leaves-7087925__340.jpg,Nature Plant Leaves Garden Flora,7,2
https://cdn.pixabay.com/photo/2022/04/04/09/46/grass-7110760__340.jpg,Frost Nature Landscape Grass Winter,2,1
https://cdn.pixabay.com/photo/2022/03/20/09/27/mountains-7080346__340.jpg,Mountain Alps Alpine Peak Mountains,5,0
https://cdn.pixabay.com/photo/2022/03/19/23/47/bird-7079725__480.jpg,Bird Goldfinch Feahters Plumage,14,10
https://cdn.pixabay.com/photo/2021/08/19/10/47/kangaroo-6557734__340.jpg,Joey Kangaroo Animals,82,101
https://cdn.pixabay.com/photo/2022/04/11/20/49/river-7126599__340.jpg,Mountain Nature Trees River,1,0
https://cdn.pixabay.com/photo/2017/05/28/10/23/swan-2350668__340.jpg,White Swan Baby,1113,154
https://cdn.pixabay.com/photo/2022/03/27/07/31/animal-7094239__340.jpg,Mammal Fur Animal Cat Feline Pet,10,7
https://cdn.pixabay.com/photo/2022/02/20/03/40/primroses-7023666__340.jpg,Flowers Red Petals Primroses,43,37
https://cdn.pixabay.com/photo/2022/04/04/12/42/old-man-7111156__340.jpg,Man Old Fashion Portrait,1,0
https://cdn.pixabay.com/photo/2022/03/10/21/13/stork-7060765__340.jpg,Stork Wading Bird Animal,29,30
https://cdn.pixabay.com/photo/2019/04/23/09/04/indoor-4148898__340.jpg,Interior Home Indoor Living Room,124,26
https://cdn.pixabay.com/photo/2020/08/12/19/28/great-wall-of-china-5483516__340.jpg,Wall China Great Beijing Of,115,30
https://cdn.pixabay.com/photo/2018/08/14/07/06/mountain-3604825__340.jpg,Sky Mountain Field Agriculture,198,30
https://cdn.pixabay.com/photo/2022/02/18/08/43/horse-7020195__340.jpg,Equidae White Horse Pasture,43,63
https://cdn.pixabay.com/photo/2021/12/23/17/04/monster-6889653__340.jpg,Horror Werewolf Wolf Dark Monster,15,6
https://cdn.pixabay.com/photo/2020/09/13/16/24/japanese-lantern-5568727__340.jpg,Shinto Japanese Lantern,55,15
https://cdn.pixabay.com/photo/2020/04/14/16/09/sloth-5043324__340.png,Rest Animal Sloth Sleep Sleeping,138,21
https://cdn.pixabay.com/photo/2022/03/18/11/08/butterfly-7076408__340.jpg,Insect Butterfly Winged,4,2
https://cdn.pixabay.com/photo/2018/11/26/19/43/autumn-3840138__480.jpg,Fall Leaves Gold Wood Red,166,26
https://cdn.pixabay.com/photo/2022/01/13/14/45/house-6935453__340.jpg,Panels Architecture House Solar,1,1
https://cdn.pixabay.com/photo/2022/02/13/05/38/moon-7010390__340.jpg,Sky Planet Moon Earth Stars,13,0
https://cdn.pixabay.com/photo/2019/03/24/08/28/cherry-blossoms-4077043__340.jpg,Cherry Pink Spring Blossoms Branch,435,79
https://cdn.pixabay.com/photo/2018/04/29/01/15/coast-3358820__340.jpg,Coast Algae Shore Beach Sea,732,78
https://cdn.pixabay.com/photo/2020/06/10/07/56/heaven-5281668__340.jpg,Heaven Path Nature Drone Road,98,12
https://cdn.pixabay.com/photo/2021/10/07/20/46/playstation-6689793__340.jpg,Joystick Playstation Play Console,6,0
https://cdn.pixabay.com/photo/2022/03/19/22/02/flower-7079600__340.jpg,Flower Bloom Magnolia Spring Bush,14,18
https://cdn.pixabay.com/photo/2022/02/21/14/33/windmill-7026895__340.jpg,Windmill Monument Wooden,38,51
https://cdn.pixabay.com/photo/2022/03/24/05/39/bird-7088299__340.jpg,Woodpecker. Japanese Pygmy,17,12
https://cdn.pixabay.com/photo/2021/12/19/23/51/christmas-ball-6882072__340.jpg,Christmas Ball Tree,54,48
https://cdn.pixabay.com/photo/2019/04/06/19/22/glass-4108085__340.jpg,Oil Bottle Glass Flowers Wellness,318,88
https://cdn.pixabay.com/photo/2022/03/25/03/19/peach-blossom-7090198__340.jpg,Blossom Flower Peach Spring Branch,7,12
https://cdn.pixabay.com/photo/2017/12/01/03/17/landscape-2990060__340.jpg,Mountain Person Water Landscape Man,406,72
https://cdn.pixabay.com/photo/2022/03/23/13/43/bird-7087260__340.jpg,Bird Robin Ornithology European,13,13
https://cdn.pixabay.com/photo/2022/03/28/07/49/traffic-7096874__340.jpg,Traffic Asphalt Car Road Vehicle,12,10
https://cdn.pixabay.com/photo/2022/03/17/14/10/siberian-squill-7074755__480.jpg,Flowers Siberian Plant Squill,20,19
https://cdn.pixabay.com/photo/2021/04/01/20/49/trees-6143244__340.jpg,Forest Trees Hiking Park Sunlight,148,78
https://cdn.pixabay.com/photo/2022/04/08/09/38/child-7119152__340.jpg,On pourtant un être scélérat. sourire peut et,0,4
https://cdn.pixabay.com/photo/2022/03/18/18/44/animal-7077179__340.jpg,Mammal Greyhound Animal Dog Species,18,15
https://cdn.pixabay.com/photo/2022/04/03/15/46/desert-7109306__340.jpg,Sand Wallpaper Dunes Desert,3,0
https://cdn.pixabay.com/photo/2022/03/12/12/11/splash-7064053__340.jpg,Water Waterdrops Gush Splash,18,10
https://cdn.pixabay.com/photo/2019/03/18/12/09/cross-4062996__340.jpg,Cross Religion Christ Easter,188,48
https://cdn.pixabay.com/photo/2022/01/27/05/42/squirrel-6971118__340.jpg,Forest Squirrel Rodent Wildlife,61,55
https://cdn.pixabay.com/photo/2022/03/22/02/56/peach-blossom-7084248__340.jpg,Flowerbuds Blossom White Peach Flowers,14,22
https://cdn.pixabay.com/photo/2021/02/07/10/06/beach-5990648__340.jpg,Trees Coast Palm Coastline Beach Sea,38,14
https://cdn.pixabay.com/photo/2022/03/28/07/51/traffic-7096880__340.jpg,Subaru Traffic Car Road Vehicle,12,10
https://cdn.pixabay.com/photo/2022/03/29/15/39/bird-7099633__340.jpg,de Oiseaux au lever soleil.,1,0
https://cdn.pixabay.com/photo/2022/03/16/17/14/tree-7072855__340.jpg,Cherry Blossom Nature Tree Spring,28,25
https://cdn.pixabay.com/photo/2022/03/27/15/58/city-7095502__340.jpg,Night Seoul Evening City Urban,4,0
https://cdn.pixabay.com/photo/2021/09/13/16/49/airplane-6621932__340.jpg,Flight Travel Aviation Airplane,8,1
https://cdn.pixabay.com/photo/2019/12/27/07/58/fire-4721862__340.jpg,Burn Fire Smoke Hot Flame,99,22
https://cdn.pixabay.com/photo/2022/04/01/14/07/hibiscus-7104882__340.jpg,Purple Hibiscus Flower,3,2
https://cdn.pixabay.com/photo/2022/03/22/19/26/bird-7085830__340.jpg,Tit Songbird Blue Bird Garden,17,18
https://cdn.pixabay.com/photo/2021/11/03/00/37/buildings-6764387__340.jpg,Buildings Glass City Architecture,21,3
https://cdn.pixabay.com/photo/2020/01/14/08/48/nude-4764470__340.jpg,Model Body Nude Erotic Naked Sexy,116,5
https://cdn.pixabay.com/photo/2022/03/14/22/25/stream-7069133__340.jpg,Sun Trees Dusk Field Sunset Stream,7,0
https://cdn.pixabay.com/photo/2022/04/08/13/18/cat-7119484__340.jpg,Nature Animal Cat Feline Pet,2,0
https://cdn.pixabay.com/photo/2022/02/20/08/58/mountains-7023998__340.jpg,Sunny Nature Landscape Day Mountains,17,11
https://cdn.pixabay.com/photo/2015/01/09/11/09/meeting-594091__340.jpg,Brainstorming Business Meeting,596,125
https://cdn.pixabay.com/photo/2022/04/06/07/19/cherry-blossoms-7114964__340.jpg,Cherry Sakura Pink Flowers Blossoms,0,0
https://cdn.pixabay.com/photo/2022/02/17/10/13/flower-7018428__340.jpg,Blossom Flower Rose Bloom Gift,41,39
https://cdn.pixabay.com/photo/2020/05/14/02/31/covid-19-5169689__340.jpg,Health Covid-19 Corona Coronavirus,46,10
https://cdn.pixabay.com/photo/2018/06/12/02/42/jesus-3469896__480.jpg,Christian Jesus Spirit Holy God,331,95
https://cdn.pixabay.com/photo/2022/03/06/12/51/flowers-7051623__340.jpg,Bloom Flowers Spring Seasonal Crocus,35,27
https://cdn.pixabay.com/photo/2016/12/09/11/33/smartphone-1894723__340.jpg,Smartphone Cellphone Touchscreen,785,262
https://cdn.pixabay.com/photo/2018/01/26/08/15/dining-room-3108037__340.jpg,Dining Modern White Living Room,302,62
https://cdn.pixabay.com/photo/2022/03/09/20/39/fur-7058681__340.jpg,(optional) description a Add,26,24
https://cdn.pixabay.com/photo/2022/02/03/00/58/stars-6989616__340.jpg,Background Pattern Stars Bokeh,30,48
https://cdn.pixabay.com/photo/2019/05/05/00/41/bible-4179472__340.jpg,New Old Testament Bible,173,66
https://cdn.pixabay.com/photo/2022/02/07/13/59/river-6999449__340.jpg,of It Santo Toribio is in rock overlooking river. and monastery the city Soria nestled,51,50
https://cdn.pixabay.com/photo/2019/06/19/07/06/morning-4284120__340.jpg,Flower Morning Dawn Anemone Sip Wood,320,62
https://cdn.pixabay.com/photo/2021/07/04/16/19/dragonfly-6386838__340.jpg,Insect Dragonfly Banded Demoiselle,67,38
https://cdn.pixabay.com/photo/2022/03/04/11/40/van-cat-7047106__340.jpg,Snow Cat Armenian Van Winter,6,4
https://cdn.pixabay.com/photo/2022/03/18/08/34/forest-7076129__340.jpg,Forest Lichen Ecology Woods Moss,19,16
https://cdn.pixabay.com/photo/2022/01/06/22/25/tulips-6920385__340.jpg,Flowers Tulips Pink,51,46
https://cdn.pixabay.com/photo/2022/02/05/00/04/dog-6993808__340.jpg,Snout Fur Animal Dog Canine Pet,38,8
https://cdn.pixabay.com/photo/2022/03/07/15/17/seedling-7053906__480.jpg,Aufgenommen 5.3.2022 am,36,31
https://cdn.pixabay.com/photo/2021/07/15/21/38/buddhist-temple-6469455__340.jpg,Alley Temple Buddhist Building,20,7
https://cdn.pixabay.com/photo/2020/04/13/22/55/sugar-5040276__340.jpg,Calories Cubes Sweet Sugar,86,51
https://cdn.pixabay.com/photo/2022/03/24/11/26/whooper-swan-7088893__340.jpg,Whooper Bird Spring Swan Sunset,3,0
https://cdn.pixabay.com/photo/2022/04/04/09/48/field-7110763__340.jpg,de Colza Champ à floraison,0,0
https://cdn.pixabay.com/photo/2022/02/21/07/23/popcorn-7025972__340.jpg,Eating Girl Food Watching Popcorn,5,0
https://cdn.pixabay.com/photo/2022/04/08/16/27/dj-7119849__340.jpg,Dj Bokeh Technology Music Party,2,0
https://cdn.pixabay.com/photo/2022/02/19/18/26/flowers-7023237__340.jpg,Flowers Coneflower Yellow,45,49
https://cdn.pixabay.com/photo/2021/10/25/08/48/newborn-6740224__340.jpg,Newborn Sleep Sleeping Costume Baby,16,4
