Links,Tags,Likes,Comments
https://cdn.pixabay.com/photo/2022/03/06/05/30/clouds-7050884__480.jpg,Sky Clouds Atmosphere Blue,196,55
https://cdn.pixabay.com/photo/2022/04/07/11/45/bird-7117346__340.jpg,Bird Hummingbird Ornithology,76,20
https://cdn.pixabay.com/photo/2022/02/28/15/28/sea-7039471__340.jpg,Rainbow Subtropical Rainfall Sea,282,106
https://cdn.pixabay.com/photo/2022/04/04/02/52/cherry-blossoms-7110279__340.jpg,Cherry Sakura Road Japan Blossoms,42,11
https://cdn.pixabay.com/photo/2022/04/09/18/06/cape-marguerite-7121992__340.jpg,Flower Marguerite Plant Cape,39,15
https://cdn.pixabay.com/photo/2021/11/13/23/06/tree-6792528__340.jpg,Rest Tree Under Relaxing The,522,108
https://cdn.pixabay.com/photo/2022/04/07/02/56/cottontail-rabbit-7116707__340.jpg,Rabbit Wild Cottontail Grass,51,10
https://cdn.pixabay.com/photo/2022/03/19/21/11/crocus-7079550__340.jpg,Flowers Spring Crocus Plant,135,44
https://cdn.pixabay.com/photo/2022/04/09/17/30/coffee-7121939__340.jpg,Café Table Drink Coffee Vacation,26,5
https://cdn.pixabay.com/photo/2022/03/25/19/24/waterfall-7091641__340.jpg,Nature Epic Fall Waterfall Light,96,21
https://cdn.pixabay.com/photo/2021/08/25/20/42/field-6574455__340.jpg,Nature Field Dawn Morning Sunrise,807,131
https://cdn.pixabay.com/photo/2022/04/04/18/03/bird-7111988__340.jpg,Bird Animal Robin Birdwatching,69,19
https://cdn.pixabay.com/photo/2022/04/04/07/58/seedlings-7110591__340.jpg,Seedlings Bloom Flowers Spring Soil,42,9
https://cdn.pixabay.com/photo/2022/03/23/21/27/road-7087957__340.jpg,Countryside Hills Highway Road,53,14
https://cdn.pixabay.com/photo/2022/03/27/15/03/cityscape-7095358__340.jpg,Bridge City Monochrome Cityscape,45,13
https://cdn.pixabay.com/photo/2022/03/25/17/54/sakura-7091532__340.jpg,Cherry Sakura Water Spring Blossoms,70,12
https://cdn.pixabay.com/photo/2022/04/01/19/03/background-7105471__480.jpg,Eggs Background Template Easter Art,5,2
https://cdn.pixabay.com/photo/2022/01/31/12/46/bird-6983434__340.jpg,Ornithology Bird Chat Species Indian,171,53
https://cdn.pixabay.com/photo/2022/01/18/16/49/town-6947538__340.jpg,Night Village Town Winter Season,109,15
https://cdn.pixabay.com/photo/2022/04/09/17/42/flower-7121955__340.jpg,Pansy Blossom Flower Viola Bloom,55,36
https://cdn.pixabay.com/photo/2021/08/30/21/29/port-6587129__340.jpg,Vacations Architecture Port Lake,276,49
https://cdn.pixabay.com/photo/2022/03/16/02/03/sunflowers-7071449__340.jpg,Flowers Sunflowers Plant,54,21
https://cdn.pixabay.com/photo/2022/03/28/18/41/coffee-7098126__340.jpg,Flowers Spring Morning Coffee,40,10
https://cdn.pixabay.com/photo/2022/02/12/06/21/roys-peak-7008528__340.jpg,Wanaka Lake Peak Roys Mountains,69,19
https://cdn.pixabay.com/photo/2021/11/21/21/14/mountain-6815304__340.jpg,for downloads you likes. and many Thank everyone.,197,0
https://cdn.pixabay.com/photo/2021/08/22/15/48/nature-6565499__340.jpg,Outdoors Nature Beach Exploration,272,150
https://cdn.pixabay.com/photo/2022/03/03/11/18/nature-7045125__340.jpg,of Shot Danish sunset. West Coast during The Jutland.,48,11
https://cdn.pixabay.com/photo/2022/03/16/21/01/gentoo-penguin-7073391__340.jpg,Bird Gentoo Penguin Animal,93,22
https://cdn.pixabay.com/photo/2021/11/26/20/45/lantern-6826698__340.jpg,Heaven Tree Water Lantern Beach Sea,243,31
https://cdn.pixabay.com/photo/2022/04/03/05/03/easter-7108066__340.jpg,Spring Easter Bunny,17,10
https://cdn.pixabay.com/photo/2018/01/14/23/12/nature-3082832__340.jpg,brown on rock daytime green during formation lake trees,3098,495
https://cdn.pixabay.com/photo/2022/02/27/19/46/tourist-attraction-7037967__340.jpg,Attraction Tower Tourist Eiffel Travel,83,21
https://cdn.pixabay.com/photo/2022/04/07/22/23/menhir-7118382__480.jpg,Menhir Clouds Stones Standing,64,49
https://cdn.pixabay.com/photo/2022/01/13/18/05/road-6935773__340.jpg,Frost Path Trees Snow Road Winter,133,24
https://cdn.pixabay.com/photo/2022/04/10/07/03/bird-7122753__340.jpg,Bird Woodpecker,28,20
https://cdn.pixabay.com/photo/2021/11/25/19/50/tape-6824489__340.jpg,Retro Classic Music Tape Cassette,134,20
https://cdn.pixabay.com/photo/2022/01/10/15/29/wind-mills-6928590__340.jpg,Wind Energy Clouds Power Mills,144,101
https://cdn.pixabay.com/photo/2022/02/15/07/27/travel-7014427__340.jpg,Piran Square Tartini Tourism Travel,70,19
https://cdn.pixabay.com/photo/2022/04/11/04/33/easter-eggs-7124718__340.jpg,Eggs Easter Colored Nest,29,0
https://cdn.pixabay.com/photo/2022/02/07/22/27/winter-7000429__340.jpg,Season Nature Outdoors Winter Travel,111,24
https://cdn.pixabay.com/photo/2022/04/11/09/40/glacier-7125386__340.jpg,Dying Melting Glaciers Glacier,36,27
https://cdn.pixabay.com/photo/2021/11/01/21/31/forest-6761846__340.jpg,Forest Nature Jungle Tropical Green,135,22
https://cdn.pixabay.com/photo/2022/02/05/08/13/tulip-6994245__340.jpg,Blossom Flower Bloom Tulip Petals,92,35
https://cdn.pixabay.com/photo/2022/04/07/13/06/flowers-7117461__340.jpg,Flowers Pink Petals,62,0
https://cdn.pixabay.com/photo/2022/02/22/03/22/passiflora-7027917__340.jpg,Flower Passion Passiflora,97,66
https://cdn.pixabay.com/photo/2021/11/02/21/57/prayer-6764197__340.jpg,Blessing Religion Hope Faith Prayer,175,57
https://cdn.pixabay.com/photo/2022/04/09/10/13/galaxy-7121195__340.jpg,Universe Galaxy Star Cosmos Space,45,40
https://cdn.pixabay.com/photo/2022/03/31/09/25/dragonfly-7102558__480.jpg,Insect Dragonfly Nature Macro,19,3
https://cdn.pixabay.com/photo/2022/01/10/18/09/budapest-6928973__340.jpg,Church Budapest Architecture Hungary,107,21
https://cdn.pixabay.com/photo/2022/03/16/11/27/trees-7072255__340.jpg,Forest Trees Leaves Foliage Magic,66,18
https://cdn.pixabay.com/photo/2021/12/11/07/59/hotel-6862159__340.jpg,der Reha mit bei gemacht Die liegt wunderbarer Adams tollen in als Klausenbach. Es Heike Hope meinem erste Nordrach die Dr. 1880! einen Film Bridges genauer Wie Ort. Aufenthalt gibt war Lehmann Kolonie! Klinik Makatsch Ärztin für Erholung! Das,94,14
https://cdn.pixabay.com/photo/2021/12/22/16/50/landscape-6887936__340.jpg,This plantation which tree reconstruction woods Hiei owned constructions old temple. near a useful Mt. trees buildings. summit by Enryaku-ji temple managed and used future The crafts. cypress of for is Hinoki the (848m). In very are site,160,45
https://cdn.pixabay.com/photo/2022/04/07/13/08/flowers-7117464__340.jpg,Nature Blossom Bloom Flowers Growth,63,0
https://cdn.pixabay.com/photo/2022/02/04/10/31/cow-6992475__340.jpg,any day! ☺️ My babies) (or due are baby,155,142
https://cdn.pixabay.com/photo/2022/01/02/19/43/port-6910972__340.jpg,Ship Port Sweden Boat Sea,89,22
https://cdn.pixabay.com/photo/2022/04/08/21/42/heron-7120365__340.jpg,Pixabay Photographed images or - selling https://pixabay.com/service/license/ February 29 elsewhere. license FORBIDS Here a link as licence: 2021 to stock on is sites the,34,51
https://cdn.pixabay.com/photo/2021/11/01/13/58/leaf-6760484__340.jpg,Nature Autumn Fall Leaf Season,171,53
https://cdn.pixabay.com/photo/2021/08/27/18/50/water-6579313__340.jpg,Water Ringedalsvannet Trolltunga,202,45
https://cdn.pixabay.com/photo/2021/12/01/18/17/cat-6838844__340.jpg,European Shorthair Cat Feline Pet,156,49
https://cdn.pixabay.com/photo/2022/01/26/20/43/baboon-6969935__340.jpg,Gesture Wildlife Baboon Animal,140,41
https://cdn.pixabay.com/photo/2022/04/10/19/28/savoy-7124124__340.jpg,Cabbage Vegetables Carrots Savoy,28,20
https://cdn.pixabay.com/photo/2022/03/16/04/08/koi-fish-7071556__480.jpg,Water Fish Koi Pond,54,64
https://cdn.pixabay.com/photo/2021/07/09/02/29/family-6398107__340.jpg,People Beach Family Ocean,219,57
https://cdn.pixabay.com/photo/2022/02/26/21/47/elephant-7036431__340.jpg,Animals Elephant Baby,104,35
https://cdn.pixabay.com/photo/2022/04/10/19/28/savoy-7124124__340.jpg,Cabbage Vegetables Carrots Savoy,24,16
https://cdn.pixabay.com/photo/2022/04/10/10/08/ranunculus-7123057__340.jpg,(optional) description a Add,25,15
https://cdn.pixabay.com/photo/2022/04/08/17/33/great-cormorant-7119976__340.jpg,Great Bird Cormorant,36,24
https://cdn.pixabay.com/photo/2022/04/10/19/07/flower-7124081__340.jpg,Flower Daffodil Plant Petals,21,14
https://cdn.pixabay.com/photo/2022/01/28/18/46/sea-6975501__340.jpg,Waves Storm Sky Clouds Overcast Sea,102,38
https://cdn.pixabay.com/photo/2017/02/08/17/24/fantasy-2049567__340.jpg,Fantasy Butterflies Forest Mushrooms,3322,536
https://cdn.pixabay.com/photo/2022/03/15/15/19/child-7070570__340.jpg,Meadow Flowers Cute Child Boy Kid,43,2
https://cdn.pixabay.com/photo/2022/04/06/12/18/grass-7115462__340.jpg,Oats Plants Ear Barley Grass,46,44
https://cdn.pixabay.com/photo/2021/10/14/13/50/book-6709160__340.jpg,Library Reading Book Literature,130,57
https://cdn.pixabay.com/photo/2022/04/06/13/59/wood-anemones-7115637__340.jpg,Wood Anemone Buttercups Anemones,46,39
https://cdn.pixabay.com/photo/2017/12/15/13/51/polynesia-3021072__340.jpg,beach red on daytime and white during boat,2610,499
https://cdn.pixabay.com/photo/2022/04/03/09/30/flower-7108476__340.jpg,Flower Bloom Insect Bee Pollination,50,68
https://cdn.pixabay.com/photo/2022/04/11/18/14/letter-box-7126374__480.jpg,Letter Delivery Box Office Post Email,17,12
https://cdn.pixabay.com/photo/2022/01/17/23/10/sunset-6945937__340.jpg,At Sunset Calm Lake,59,18
https://cdn.pixabay.com/photo/2022/04/04/22/33/sunflowers-7112463__340.jpg,farming Illustration sunflowers,72,77
https://cdn.pixabay.com/photo/2022/02/19/21/46/beach-7023446__340.jpg,Sand North Winter Beach Sea,30,6
https://cdn.pixabay.com/photo/2022/01/13/16/37/trees-6935614__340.jpg,Nature Trees Outdoors Winter Season,90,18
https://cdn.pixabay.com/photo/2022/03/02/14/25/flower-7043267__340.jpg,Blossom Flower Rose Bloom Botany,107,91
https://cdn.pixabay.com/photo/2021/12/27/11/55/winter-6897046__340.jpg,Frost Nature Texture Macro Winter,113,32
https://cdn.pixabay.com/photo/2021/12/28/14/30/bird-6899457__340.jpg,Bird Species Ornithology Blackbird,109,27
https://cdn.pixabay.com/photo/2022/04/10/14/27/trees-7123499__340.jpg,Nature Trees Clouds Landscape Rural,14,8
https://cdn.pixabay.com/photo/2022/01/16/20/38/coffee-6943139__340.jpg,Eraser Office Pencils Coffee,69,9
https://cdn.pixabay.com/photo/2021/07/18/04/00/lotus-6474572__340.jpg,Flower Pink Lotus,279,45
https://cdn.pixabay.com/photo/2022/04/01/15/31/bus-7105041__340.jpg,noch frei… Plätze sind Es,43,34
https://cdn.pixabay.com/photo/2022/01/21/19/21/crocus-6955548__340.jpg,Flowers Crocus Plants Purple,77,16
https://cdn.pixabay.com/photo/2022/04/11/09/18/birds-7125333__340.jpg,2022 21 in Taken March,16,7
https://cdn.pixabay.com/photo/2021/12/12/22/48/mountain-6867146__340.jpg,Mountain Summit Forest Clouds Winter,82,8
https://cdn.pixabay.com/photo/2022/04/10/07/33/ice-cream-cone-7122797__340.jpg,Cone Flower Squirrel Ice Cream,16,11
https://cdn.pixabay.com/photo/2022/04/09/09/29/flower-7121113__480.jpg,Tree Flower Magnolia Flowers Spring,8,2
https://cdn.pixabay.com/photo/2022/04/06/09/46/flowers-7115215__340.jpg,Flowers Garden Bouquet,47,26
https://cdn.pixabay.com/photo/2022/03/04/09/02/winter-7046891__340.jpg,Ukraine! Help Stop the war!,56,15
https://cdn.pixabay.com/photo/2022/04/03/08/33/jay-7108357__340.jpg,Animal Snow Bird Jay Winter,62,48
https://cdn.pixabay.com/photo/2022/04/09/07/14/dungeon-7120925__340.jpg,Built museum. former in (France) Augustinian become the (Les Augustins has 1300-1400 convent a Toulouse French),17,11
https://cdn.pixabay.com/photo/2022/04/11/09/16/birds-7125327__340.jpg,Egyptian Waterfowl Goslings Birds,15,8
https://cdn.pixabay.com/photo/2022/04/06/08/16/peach-blossom-7115083__340.jpg,Blossom Tree Peach Flowers Branch,41,58
https://cdn.pixabay.com/photo/2021/12/01/15/32/happy-new-year-6838276__340.jpg,2022 Year New Regards Happy,45,10
https://cdn.pixabay.com/photo/2022/04/03/17/48/flowers-7109567__340.jpg,Flowers Botany Quince,55,47
https://cdn.pixabay.com/photo/2016/11/29/05/45/astronomy-1867616__340.jpg,Bright Constellation Dark Astronomy,2989,484
https://cdn.pixabay.com/photo/2022/02/14/10/35/flowers-7012876__340.jpg,Blossom Nature Bloom Flowers Botany,43,13
https://cdn.pixabay.com/photo/2021/08/23/08/28/path-6567149__340.jpg,Path Nature Countryside Road Rural,178,36
https://cdn.pixabay.com/photo/2022/02/14/06/54/bird-7012586__340.jpg,Bird Ibis Ornithology Spiny,141,102
https://cdn.pixabay.com/photo/2021/08/27/10/16/baby-6578335__340.jpg,Girl Portrait Daughter Child Baby,179,54
https://cdn.pixabay.com/photo/2021/12/20/15/01/christmas-tree-6883263__340.jpg,Christmas Ornaments Tree,147,99
https://cdn.pixabay.com/photo/2021/09/30/18/10/sunrise-6670717__340.jpg,Mountains Fog Jura Sunrise Swabian,140,27
https://cdn.pixabay.com/photo/2022/04/05/22/54/giant-lily-7114496__480.jpg,meters hoch. Macht Leben years. stirbt… dies... Dorianthes nur in Palmeri. life 40 first erste high. ihrem 3 Meter and Jahren. ***************************** ihre her einmal at flower Blooms nach Blüht Makes only Blume und once,47,32
https://cdn.pixabay.com/photo/2022/04/06/22/27/postcard-7116453__340.jpg,Birds Peacocks Postcard Card Greeting,31,36
https://cdn.pixabay.com/photo/2022/01/25/04/42/bird-6965228__340.jpg,Ornithology Egret Bird Great Species,89,47
https://cdn.pixabay.com/photo/2022/01/10/16/30/flowers-6928749__340.jpg,Cliff Flowers Coast Grass Beach Sea,79,12
https://cdn.pixabay.com/photo/2021/12/18/17/11/flower-6879399__340.jpg,Flower Seeds Dandelion Wildflower,88,14
https://cdn.pixabay.com/photo/2021/12/14/20/21/book-6871220__340.jpg,Shades Paper Stop Page Book Man,80,49
https://cdn.pixabay.com/photo/2021/08/23/07/38/castle-6566978__340.jpg,Park Castle Monument Building,159,27
https://cdn.pixabay.com/photo/2022/04/05/15/11/birds-7113827__340.jpg,Greylag Ornithology Birds Goose,41,28
https://cdn.pixabay.com/photo/2022/04/08/19/05/hyacinth-7120098__340.jpg,Flowers Spring Hyacinth Nature,15,9
https://cdn.pixabay.com/photo/2022/04/05/00/25/bokeh-7112555__340.jpg,Pattern Background Light Bokeh Art,27,27
https://cdn.pixabay.com/photo/2022/04/02/10/53/easter-7106722__340.jpg,Decoration Easter Bunny,55,87
https://cdn.pixabay.com/photo/2021/11/26/17/26/desert-6826299__340.jpg,Sand Dubai Desert Native Dunes,48,14
https://cdn.pixabay.com/photo/2022/04/03/09/04/pforphoto-7108433__340.jpg,Piano… The,35,25
https://cdn.pixabay.com/photo/2020/04/25/12/14/tech-5090539__340.jpg,Technology Abstract Tech Circle,404,109
https://cdn.pixabay.com/photo/2022/04/06/09/46/flowers-7115217__340.jpg,Flowers Hyacinth Garden,40,28
https://cdn.pixabay.com/photo/2022/03/28/05/17/cherry-blossoms-7096607__340.jpg,Cherry Sakura Pink Flowers Blossoms,61,24
https://cdn.pixabay.com/photo/2022/04/08/12/12/coffee-7119373__480.jpg,Template Stain Dirty Coffee,26,19
https://cdn.pixabay.com/photo/2022/02/02/13/50/happy-easter-6988491__340.jpg,Easter Spring Theme Happy Decoration,29,10
https://cdn.pixabay.com/photo/2021/12/12/01/15/lotus-6863937__340.jpg,Lotus Pads Pond Flowers Lily,101,23
https://cdn.pixabay.com/photo/2022/01/21/07/21/ring-tailed-lemur-6954076__340.jpg,Tailed Group Ring Lemur Cub,160,115
https://cdn.pixabay.com/photo/2022/04/07/04/03/bird-7116757__340.jpg,de En introducido del estornino nativa (Sturnus Sturnidae común es Argentina especie El fue la en familia años abundantemente y pinto o una ave reproduce se Aires. unos Provincia hace Buenos Paleártico. el vulgaris)​ hoy sudeste passeriforme,23,19
https://cdn.pixabay.com/photo/2021/10/11/09/04/nature-6699893__340.jpg,Evergreen Nature Spruce Branches,99,21
https://cdn.pixabay.com/photo/2022/04/08/07/22/tablets-7118912__340.jpg,Powder Drugs Tablets,22,16
https://cdn.pixabay.com/photo/2022/01/17/08/27/white-flowers-6944139__340.jpg,Flowers White Nature,49,11
https://cdn.pixabay.com/photo/2021/09/14/14/46/cologne-6624212__340.jpg,Cathedral Night Cologne River Bridge,98,27
https://cdn.pixabay.com/photo/2015/12/01/20/28/road-1072823__340.jpg,Forest Autumn Fall Road Season,5214,1126
https://cdn.pixabay.com/photo/2022/04/08/06/13/bird-7118767__340.jpg,Ornithology Bird Species Geese Fauna,23,15
https://cdn.pixabay.com/photo/2022/04/04/15/16/flowers-7111580__340.jpg,2022 von Foto März Ende,27,20
https://cdn.pixabay.com/photo/2021/10/10/20/33/mehtab-bagh-6698669__340.jpg,India Bagh Mehtab Temple Mahal Taj,73,15
https://cdn.pixabay.com/photo/2022/04/09/05/35/tulips-7120798__340.jpg,Flower Tulips Plant Flora,10,4
https://cdn.pixabay.com/photo/2022/04/04/06/59/canada-goose-7110494__340.jpg,Goose Swim Water Bird Canada,57,0
https://cdn.pixabay.com/photo/2022/03/02/19/27/earth-7043847__340.jpg,Mankind Planet Earth Homeland,36,8
https://cdn.pixabay.com/photo/2022/04/07/04/04/starling-7116759__480.jpg,de En introducido del estornino nativa (Sturnus Sturnidae común es Argentina especie El fue la en familia años abundantemente y pinto o una ave reproduce se Aires. unos Provincia hace Buenos Paleártico. el vulgaris)​ hoy sudeste passeriforme,22,17
https://cdn.pixabay.com/photo/2022/03/28/20/47/house-7098314__340.jpg,Composition view lake,81,81
https://cdn.pixabay.com/photo/2022/04/08/17/33/bird-7119983__340.jpg,Songbird Animal Blackbird Bird Fauna,18,11
https://cdn.pixabay.com/photo/2022/04/10/10/04/bird-7123044__340.jpg,mountain areas bird Japan it without in snow farmlands winter a Durian riverbanks. flat Redstart. and regions parks low wintering to is residential In inhabiting cover,10,6
https://cdn.pixabay.com/photo/2021/11/09/07/29/newborn-6780840__340.jpg,Newborn Sleeping Costume Baby,91,21
https://cdn.pixabay.com/photo/2022/04/02/20/46/cat-7107728__340.jpg,Outdoors Cat Backyard Grass Kitten,54,36
https://cdn.pixabay.com/photo/2021/06/22/16/39/arch-6356637__340.jpg,Tower Arch Road Street Eiffel Alley,261,51
https://cdn.pixabay.com/photo/2022/03/21/16/12/blackbird-7083494__340.jpg,Eating Animal Blackbird Bird Worm,70,51
https://cdn.pixabay.com/photo/2022/04/06/10/08/dog-7115247__340.jpg,Golden Water Swim Lake Dog Retriever,33,22
https://cdn.pixabay.com/photo/2022/04/09/21/10/clouds-7122287__340.jpg,Sky Clouds Atmosphere Grey,5,1
https://cdn.pixabay.com/photo/2022/04/12/12/02/flowers-7127847__340.jpg,Nature Bloom Flowers Spring Seasonal,17,14
https://cdn.pixabay.com/photo/2022/03/31/14/12/flower-7103109__340.jpg,Flower Early Liverflower Bloomer,74,57
https://cdn.pixabay.com/photo/2021/05/29/17/35/car-6293917__340.jpg,Desktop Car Sunset Wallpaper Beach,37,7
https://cdn.pixabay.com/photo/2021/10/23/03/35/mountain-6734031__340.jpg,Snow Mountain Summit Winter,85,20
https://cdn.pixabay.com/photo/2022/04/08/11/47/daffodil-7119341__340.jpg,Aufgenommen 5.3.2022 am,29,22
https://cdn.pixabay.com/photo/2021/08/29/08/49/petit-minou-lighthouse-6582717__340.jpg,Lighthouse Petit Minou Sea,120,29
https://cdn.pixabay.com/photo/2018/01/30/22/50/forest-3119826__480.jpg,Forest Nature Trees Woods Twilight,1417,188
https://cdn.pixabay.com/photo/2022/04/07/17/32/european-shorthair-7118037__340.jpg,European Animal Cat Shorthair Pet,18,8
https://cdn.pixabay.com/photo/2022/04/11/19/35/easter-bunny-7126487__340.jpg,Easter Festival Bunny,9,7
https://cdn.pixabay.com/photo/2022/03/28/17/19/mountains-7097981__340.jpg,Meadow Cabin Herb Clouds Mountains,63,55
https://cdn.pixabay.com/photo/2021/07/27/16/23/buildings-6497337__340.jpg,Hills Buildings Town Sunset Road,132,19
https://cdn.pixabay.com/photo/2022/03/14/20/54/city-7069010__340.jpg,Tourism Mexico City Travel,19,5
https://cdn.pixabay.com/photo/2022/04/09/09/29/magnolia-7121115__340.jpg,Tree Flower Magnolia Flowers Spring,2,1
https://cdn.pixabay.com/photo/2022/04/10/19/17/donkey-7124096__340.jpg,Mammal Draft Animal Donkey,10,0
https://cdn.pixabay.com/photo/2022/04/08/11/46/weave-7119337__340.jpg,Aufgenommen 20.3.2021 am,27,19
https://cdn.pixabay.com/photo/2022/04/09/14/54/fields-7121593__340.jpg,Meadow Nature Landscape Fields Rural,14,12
https://cdn.pixabay.com/photo/2022/04/08/13/45/flowers-7119514__340.jpg,Cherry This blossoms you eat friends. with We in under trees “hanami”? now sit cherry our and Have of for is Japan. season the drink ever heard,14,8
https://cdn.pixabay.com/photo/2022/03/19/08/45/alley-7078098__340.jpg,Städtchen ... einem In kleinen,57,33
https://cdn.pixabay.com/photo/2022/04/06/06/30/drake-7114868__340.jpg,Wings Waterbird Drake,20,19
https://cdn.pixabay.com/photo/2021/11/17/10/57/pine-cone-6803226__340.jpg,Cone Fir Pine Green Branch,126,43
https://cdn.pixabay.com/photo/2021/10/15/22/59/heron-6713611__340.jpg,River Lake Egret Pond Great Heron,163,127
https://cdn.pixabay.com/photo/2021/10/08/06/45/seagulls-6690361__340.jpg,Nature Ocean Sky Birds Seagulls Sea,121,30
https://cdn.pixabay.com/photo/2021/07/22/21/55/mountains-6486093__480.jpg,Nature Tourism Alpine Mountains Hike,122,24
https://cdn.pixabay.com/photo/2022/04/04/08/43/road-7110643__340.jpg,Mountain Countryside Road Landscape,29,0
https://cdn.pixabay.com/photo/2021/11/11/16/29/tree-6786654__340.jpg,Autumn Nature Tree Leaves Season,89,21
https://cdn.pixabay.com/photo/2022/03/23/17/41/fantasy-7087606__340.jpg,Plants Fantasy Elf Bird Light Magic,32,17
https://cdn.pixabay.com/photo/2022/03/12/09/27/couple-7063784__340.jpg,Meadow Nature Walking Sunset Couple,17,5
https://cdn.pixabay.com/photo/2016/12/16/15/25/christmas-1911637__340.jpg,Background Christmas Lay Flat,2860,460
https://cdn.pixabay.com/photo/2022/04/06/17/40/blackthorn-7116000__340.jpg,Blackthorn Prunus Sloe Winter Spinosa,23,20
https://cdn.pixabay.com/photo/2021/08/27/19/55/boat-6579441__340.jpg,Forest River Woods Landscape Boat,145,26
https://cdn.pixabay.com/photo/2022/04/09/18/25/walnuts-7122043__340.jpg,Food Nuts Nutrition Walnuts Healthy,11,5
https://cdn.pixabay.com/photo/2022/04/12/04/46/climate-change-7127153__340.jpg,Climate People Change Protest,12,9
https://cdn.pixabay.com/photo/2021/08/08/15/45/mountains-6531264__340.jpg,Germany Mountains Sunset Fortress,116,26
https://cdn.pixabay.com/photo/2021/11/27/18/28/candles-6828695__340.jpg,Christmas Candlelight Candles,122,60
https://cdn.pixabay.com/photo/2022/02/19/08/48/flower-7022112__340.jpg,Flower Spring Butterfly Fantasy,97,72
https://cdn.pixabay.com/photo/2022/04/04/10/39/australian-wood-duck-7110865__340.jpg,Wood Australian Bird Duck,45,44
https://cdn.pixabay.com/photo/2021/10/04/16/42/dog-6680642__340.jpg,Animal Dog Doggy Cute Puppy Pet,89,16
https://cdn.pixabay.com/photo/2022/03/31/05/07/cherry-blossom-7102224__340.jpg,Cherry Blossom Nature Flowers Spring,57,48
https://cdn.pixabay.com/photo/2021/12/26/19/36/christmas-tree-6895765__480.jpg,Holiday Christmas Season Tree,54,11
https://cdn.pixabay.com/photo/2021/07/26/22/04/sea-shell-6495338__340.jpg,Conch Giant Shell Sea,206,95
https://cdn.pixabay.com/photo/2021/02/05/18/05/paper-5985445__340.jpg,Paper Texture Crumpled Fold Shadows,186,38
https://cdn.pixabay.com/photo/2022/03/31/14/16/bee-7103114__340.jpg,Entomology Macro Bee Pollination,57,41
https://cdn.pixabay.com/photo/2022/04/06/05/26/butterfly-7114816__340.jpg,Meadow Aurora Butterfly,25,16
https://cdn.pixabay.com/photo/2021/12/02/13/02/candles-6840499__340.jpg,4 Weihnachtskerzen,70,24
https://cdn.pixabay.com/photo/2022/04/06/14/27/mute-swan-7115661__340.jpg,(optional) description a Add,40,33
https://cdn.pixabay.com/photo/2022/04/09/06/20/tulip-7120843__340.jpg,Flower Spring Tulip Flowering,9,2
https://cdn.pixabay.com/photo/2022/03/22/19/29/town-7085835__340.jpg,Countryside Town Nature Landscape,69,62
https://cdn.pixabay.com/photo/2022/04/11/07/30/birds-7124996__340.jpg,de género endémico es compone especie El la familia los a Sudamérica ) perteneciente y Furnarius una ave especies cinco rufus con Argentina. República furnáridos junto nacional Furnarius. Hornero el otras hornero ( meridional paseriforme,7,6
https://cdn.pixabay.com/photo/2022/04/05/12/00/cherry-blossom-7113414__340.jpg,Cherry Blossom Sakura Flowers Spring,32,0
https://cdn.pixabay.com/photo/2022/04/07/23/58/fantasy-7118471__340.jpg,Truth Bound Fantasy Silence No,19,24
https://cdn.pixabay.com/photo/2022/03/01/09/15/salad-7040875__340.jpg,Salad Vitamins Healthy Berry Fruit,30,10
https://cdn.pixabay.com/photo/2021/11/01/08/39/petit-minou-lighthouse-6759731__340.jpg,Lighthouse Petit Minou Sea,61,15
https://cdn.pixabay.com/photo/2022/04/11/19/05/easter-bunny-7126452__340.jpg,Decorations Easter Bunny,12,8
https://cdn.pixabay.com/photo/2022/04/09/22/33/bird-7122361__340.jpg,Ornithology Bird Species Heron Fauna,12,7
https://cdn.pixabay.com/photo/2022/04/01/08/57/shepherds-purses-7104384__480.jpg,Capsella Shepherd'S-Purses Grass,45,40
https://cdn.pixabay.com/photo/2022/04/07/11/55/bernkastel-kues-7117366__340.jpg,Germany Cityscape Bernkastel-Kues,20,10
https://cdn.pixabay.com/photo/2021/04/21/13/20/cherry-blossoms-6196363__340.jpg,Cherry Blossoms Flowers Sakura,406,211
https://cdn.pixabay.com/photo/2022/04/11/20/31/purple-flowers-7126569__340.jpg,Purple Pasqueflowers Flowers,5,2
https://cdn.pixabay.com/photo/2021/03/02/01/07/cyberpunk-6061251__340.jpg,Street Cyberpunk City Platform,220,32
https://cdn.pixabay.com/photo/2022/03/29/12/31/leaves-7099402__340.jpg,Nature Plant Leaves Botany Growth,61,16
https://cdn.pixabay.com/photo/2022/04/10/10/34/flower-7123108__340.jpg,Flower Rose Baby Petals,8,4
https://cdn.pixabay.com/photo/2022/03/05/09/23/birds-7048729__340.jpg,Birds Ornithology Species Fauna Duck,103,79
https://cdn.pixabay.com/photo/2022/04/10/18/04/robin-7123932__340.jpg,Plumage Beak Robin Feathers Bird,4,2
https://cdn.pixabay.com/photo/2018/06/13/18/20/waves-3473335__340.jpg,Waves Ocean Water Blue Beach Sea,1807,310
https://cdn.pixabay.com/photo/2022/03/05/22/13/daffodil-7050408__340.jpg,Flower Yellow Daffodil Petals,87,73
https://cdn.pixabay.com/photo/2022/04/09/16/26/bird-7121805__340.jpg,Bird Yellow Warbler Ornithology,3,2
https://cdn.pixabay.com/photo/2022/04/11/20/01/leopard-7126525__340.jpg,Mammal Animal Big Cat Leopard,7,0
https://cdn.pixabay.com/photo/2022/01/28/21/10/honeybee-6975865__340.jpg,Honeybee Sunflower Bee Pollination,51,11
