Links,Tags,Likes,Comments
https://cdn.pixabay.com/photo/2021/12/08/13/43/tree-6855748__480.jpg,Cone Tree Pine Spruce Pinecone,46,43
https://cdn.pixabay.com/photo/2022/03/06/21/23/hammer-7052581__340.jpg,Pliers Hammer Background Tool Metal,12,9
https://cdn.pixabay.com/photo/2020/08/09/21/10/couple-5476462__340.jpg,Romantic Couple Love Silhouette,118,89
https://cdn.pixabay.com/photo/2022/03/07/19/26/fortress-7054369__340.jpg,Fortress Tower Bedrock Stone Rock,11,21
https://cdn.pixabay.com/photo/2019/11/21/06/13/peacock-4641792__340.jpg,Head Peacock Animal Bird Eye,136,36
https://cdn.pixabay.com/photo/2022/03/23/21/32/lake-7087964__340.jpg,Nature Alps Lake Landscape Mountains,1,0
https://cdn.pixabay.com/photo/2018/01/06/17/08/animal-3065387__340.png,Animal Wildlife Bird Eagle Wing,255,43
https://cdn.pixabay.com/photo/2021/05/25/14/23/girl-6282604__340.jpg,Celebration Girl Flag Child,54,11
https://cdn.pixabay.com/photo/2021/08/27/08/21/video-game-6578105__340.jpg,Video Entertainment Boy Game,8,6
https://cdn.pixabay.com/photo/2022/02/02/11/22/motorcycles-6988203__340.jpg,750 developed motorcycle forces). a KS German combination Wehrmacht sidecar and (armed The II-era Zündapp for is the War World,18,16
https://cdn.pixabay.com/photo/2020/04/28/19/21/nostalgia-5106057__340.jpg,Retro Vintage Nostalgia Time,138,57
https://cdn.pixabay.com/photo/2017/06/09/17/26/baby-2387661__340.jpg,Cute Cry Crying Baby,196,24
https://cdn.pixabay.com/photo/2022/01/16/16/55/sweets-6942671__340.jpg,Lollipops Treats Candies Sweets,2,0
https://cdn.pixabay.com/photo/2022/02/06/22/18/thailand-6998182__340.jpg,Nature Ocean Island Thailand Sea,5,1
https://cdn.pixabay.com/photo/2022/01/28/17/47/mountains-6975271__340.jpg,Pitschenberg einer von Panoramablick Wanderung auf den,18,15
https://cdn.pixabay.com/photo/2019/06/05/10/34/mimosa-4253396__340.jpg,Mimosa Yellow Vase Flowers,144,23
https://cdn.pixabay.com/photo/2021/11/12/00/53/movie-projector-6787644__340.jpg,Projector Vintage Movie,7,2
https://cdn.pixabay.com/photo/2017/11/03/20/11/fire-2915539__340.jpg,Burn Campfire Fire Burning Flames,284,46
https://cdn.pixabay.com/photo/2017/09/10/18/29/universe-2736507__340.jpg,Galaxy Double Portrait Universe,300,47
https://cdn.pixabay.com/photo/2022/01/01/15/16/building-6907820__340.jpg,Street Building Road Skyline,5,1
https://cdn.pixabay.com/photo/2017/10/17/14/11/background-2860761__340.jpg,Background Template Texture Structure,269,26
https://cdn.pixabay.com/photo/2021/12/21/16/11/mushroom-6885578__340.jpg,Moss Forest Small Mushroom,19,18
https://cdn.pixabay.com/photo/2021/08/31/17/43/tennis-court-6589655__340.jpg,Basketball Court City Tennis,5,1
https://cdn.pixabay.com/photo/2017/08/29/09/22/tealight-2692556__340.jpg,Tea Light Candlelight Worships,339,22
https://cdn.pixabay.com/photo/2019/11/26/18/26/road-4655176__340.jpg,Autumn Trees Atmosphere Leaves Road,106,27
https://cdn.pixabay.com/photo/2017/07/21/23/41/note-2527458__340.jpg,Paper Note Office Memo Stickies,292,24
https://cdn.pixabay.com/photo/2021/09/04/01/52/village-6596823__340.jpg,Scenery Mountain Countryside Village,13,1
https://cdn.pixabay.com/photo/2021/08/21/07/23/cordage-6562010__340.jpg,Pirate Ship Cordage Nautical Ropes,10,2
https://cdn.pixabay.com/photo/2022/01/06/13/53/planner-6919530__340.jpg,2022 Planner Journal Planning,7,4
https://cdn.pixabay.com/photo/2016/11/14/02/56/students-1822449__480.jpg,Students Communication Announcement,267,28
https://cdn.pixabay.com/photo/2019/03/08/19/52/galata-4043037__340.jpg,Turkey Istanbul Tower Galata Marine,93,37
https://cdn.pixabay.com/photo/2021/11/03/14/44/tool-6766012__340.jpg,Drawing Melody Tool Violin Music,19,14
https://cdn.pixabay.com/photo/2020/11/25/14/06/fox-5775857__340.jpg,Mammal Animal Predator Fox Sleeping,46,6
https://cdn.pixabay.com/photo/2022/02/22/15/15/girl-7029034__340.jpg,Model Girl Student Stairs Book,2,0
https://cdn.pixabay.com/photo/2017/10/06/16/22/head-2823697__340.jpg,Head Submerged Swimming Swimmer Man,296,34
https://cdn.pixabay.com/photo/2017/11/19/20/37/lost-places-2963764__340.jpg,Places Pforphoto Lost Columns Hall,208,33
https://cdn.pixabay.com/photo/2018/03/16/16/18/girl-3231703__340.jpg,Relax Girl Listening Music,166,35
https://cdn.pixabay.com/photo/2015/11/10/17/00/still-life-1037378__340.jpg,Still White Book Life A Teddy Read,641,142
https://cdn.pixabay.com/photo/2021/12/17/15/35/cat-6876810__340.jpg,Eyes Tortoise Face Shell Cat,35,34
https://cdn.pixabay.com/photo/2021/12/09/11/53/empire-state-building-6858030__340.jpg,States York United New,6,4
https://cdn.pixabay.com/photo/2021/12/30/13/12/smoke-6903895__340.jpg,Environment Pollution Smoke Factory,9,6
https://cdn.pixabay.com/photo/2022/03/15/14/57/frozen-7070501__340.jpg,Frost River Snow Winter Ice Frozen,2,0
https://cdn.pixabay.com/photo/2017/09/06/12/50/smoke-2721311__480.jpg,Background Abstract Smoke,132,13
https://cdn.pixabay.com/photo/2017/02/28/20/59/carrots-2106825__340.jpg,Yellow Carrots Vegetables Beets,247,74
https://cdn.pixabay.com/photo/2022/03/31/08/17/dining-7102445__340.jpg,Labor portrait,0,0
https://cdn.pixabay.com/photo/2021/01/08/09/40/waterfall-5899421__340.jpg,Rocks Cliff Waterfall Cascade Sea,48,10
https://cdn.pixabay.com/photo/2022/01/16/12/31/torrent-6941904__340.jpg,Gorges France) Gard Concluses des - (Lussan,25,48
https://cdn.pixabay.com/photo/2018/07/20/14/01/grapes-3550729__340.jpg,Fresh Food Grapes Fruits Healthy,214,40
https://cdn.pixabay.com/photo/2015/10/10/13/42/holzfigur-980784__340.jpg,For Struggle Stones Wooden Figure Life,328,77
https://cdn.pixabay.com/photo/2022/02/20/09/16/lotus-7024024__340.jpg,Flowers Lotus,2,1
https://cdn.pixabay.com/photo/2021/11/05/01/27/trees-6769901__340.jpg,Nature Trees Snow Winter Season,9,0
https://cdn.pixabay.com/photo/2020/03/21/20/03/real-estate-4955086__340.jpg,Estate Real Villa Luxury Vacation,25,2
https://cdn.pixabay.com/photo/2022/01/11/12/03/bird-6930443__340.jpg,Bird Chaffinch Species Ornithology,32,30
https://cdn.pixabay.com/photo/2022/04/01/15/54/flower-7105099__340.jpg,Blossom Flower Violet Bloom Botany,2,0
https://cdn.pixabay.com/photo/2022/03/04/14/54/mushrooms-7047498__340.jpg,Forest Nature Mushrooms Mycology,6,5
https://cdn.pixabay.com/photo/2016/11/29/05/01/lights-1867437__340.jpg,Hanging Lights Decoration Illuminated,172,26
https://cdn.pixabay.com/photo/2016/06/18/22/36/cherries-1465801__340.jpg,Heart Cherries Sweet,314,61
https://cdn.pixabay.com/photo/2020/02/07/22/43/ostrich-4828594__340.jpg,Klerksdorp Dad and South Ostrich Africa chick,116,58
https://cdn.pixabay.com/photo/2021/11/17/22/55/christmas-6805036__340.jpg,Christmas Tree,2,1
https://cdn.pixabay.com/photo/2021/11/08/10/26/fireplace-6778816__340.jpg,Bonfire Fireplace Campfire Fire,5,1
https://cdn.pixabay.com/photo/2016/12/30/12/16/cat-1940487__480.jpg,Kitty Fur Portrait Mackerel Cat,381,96
https://cdn.pixabay.com/photo/2020/07/28/15/32/child-5445463__340.jpg,African Orphan Poor Poverty Child,18,5
https://cdn.pixabay.com/photo/2022/03/18/09/11/tree-7076200__340.jpg,Bark Nature Tree Trunk Moss Wood,1,1
https://cdn.pixabay.com/photo/2018/08/17/01/14/horse-3611921__340.jpg,Mammal Horse Equestrian Animal,161,31
https://cdn.pixabay.com/photo/2022/02/02/02/48/flowers-6987420__340.jpg,Flowers Field Mountains Canyon,10,5
https://cdn.pixabay.com/photo/2021/02/27/13/42/comedy-6054626__340.jpg,Humor Stage Comedy Bar Club,21,5
https://cdn.pixabay.com/photo/2017/07/03/09/54/dog-2467149__340.jpg,Small Dog Cute Young Puppy,323,40
https://cdn.pixabay.com/photo/2017/11/12/13/47/forest-2942492__340.jpg,Sun Forest Rays Light Sunbeam,288,42
https://cdn.pixabay.com/photo/2017/03/03/09/49/earth-2113656__340.jpg,Atmosphere Planet Cosmos Earth Space,211,46
https://cdn.pixabay.com/photo/2020/01/14/13/53/oldtimer-4765102__340.jpg,Castle Antique Lake Car Garden Palace,229,32
https://cdn.pixabay.com/photo/2014/05/26/07/53/building-plan-354233__340.jpg,Floor Blueprint Architect Plan,238,74
https://cdn.pixabay.com/photo/2021/08/14/18/44/flower-6545960__340.jpg,Flower Blossom Bloom Gladiolus,46,41
https://cdn.pixabay.com/photo/2021/08/23/10/21/headphones-6567453__340.jpg,High Sound Headset Headphones Quality,5,1
https://cdn.pixabay.com/photo/2021/10/29/14/45/woodpecker-6752071__480.jpg,small &quot;Japanese smallest Piciformes. Pygmy Japan&#39;s Woodpecker&quot;.,39,30
https://cdn.pixabay.com/photo/2022/01/18/08/43/wings-6946618__340.jpg,Wings Delicious Chicken,7,2
https://cdn.pixabay.com/photo/2022/02/20/18/09/father-7025049__340.jpg,Childhood Father Daughter Baby,2,0
https://cdn.pixabay.com/photo/2021/07/20/03/52/crocodile-6479670__340.jpg,Alligator Predator Crocodile Reptile,32,9
https://cdn.pixabay.com/photo/2022/03/18/13/37/pansy-7076733__340.jpg,Flower Pansy Petals Purple,1,0
https://cdn.pixabay.com/photo/2019/05/28/10/15/rock-4234805__340.jpg,Balance Spa Meditation Zen Rock,66,12
https://cdn.pixabay.com/photo/2021/11/25/15/28/temple-6823939__340.jpg,Carving Buddhism China Stone Temple,4,0
https://cdn.pixabay.com/photo/2021/09/21/06/39/bee-6642592__340.jpg,Insect Pollination Bee Pollinate,50,45
https://cdn.pixabay.com/photo/2021/01/15/07/47/man-5918679__340.jpg,Man Manufacturing Welding Welder,7,1
https://cdn.pixabay.com/photo/2022/02/17/12/26/family-7018686__340.jpg,Muslim Cartoon Family,2,0
https://cdn.pixabay.com/photo/2022/02/27/15/44/grey-heron-7037527__340.jpg,Grey Heron Bird Animal,18,17
https://cdn.pixabay.com/photo/2021/03/06/21/05/aster-6074761__340.jpg,Dewdrops Flower Wet Aster Dew,68,43
https://cdn.pixabay.com/photo/2022/02/17/18/15/coast-7019255__340.jpg,Coast Caves Rocky Sea,4,0
https://cdn.pixabay.com/photo/2021/10/22/11/13/swan-goose-6732355__340.jpg,Goose Swan Bird,65,97
https://cdn.pixabay.com/photo/2022/03/20/08/55/town-7080277__340.jpg,Quarter Old Town Asia Tourism Travel,0,0
https://cdn.pixabay.com/photo/2021/08/25/00/59/television-6572135__340.jpg,Television Vintage Tv,33,55
https://cdn.pixabay.com/photo/2016/11/29/06/18/home-office-1867759__480.jpg,Display Computer Home Office Desk,176,23
https://cdn.pixabay.com/photo/2022/02/26/14/30/cat-7035855__340.jpg,Kitty Bond Animal Cat Feline Pet,10,9
https://cdn.pixabay.com/photo/2021/12/20/16/36/snowflake-cookies-6883452__340.jpg,Cookies Dessert Snowflake,12,3
https://cdn.pixabay.com/photo/2022/03/29/19/38/duck-7100036__340.jpg,Plumage Water Lake Bird Flying Duck,1,0
https://cdn.pixabay.com/photo/2015/09/25/04/19/children-956676__340.jpg,Photographers Children Pictures Taking,428,65
https://cdn.pixabay.com/photo/2021/12/08/08/46/cargo-ship-6855031__340.jpg,Freighter Ship Cargo Container,31,52
https://cdn.pixabay.com/photo/2021/08/23/17/32/tuna-6568345__340.jpg,Fish Fillet Raw Tuna,7,2
https://cdn.pixabay.com/photo/2022/03/15/19/58/birds-7071101__340.jpg,Species Swans Birds Ornithology,7,4
https://cdn.pixabay.com/photo/2021/07/11/16/04/light-painting-6404195__340.jpg,Freezelight Painting Light Music Art,28,31
https://cdn.pixabay.com/photo/2019/02/06/11/59/oil-3979023__340.jpg,Maintenance Oil The Changing,59,9
https://cdn.pixabay.com/photo/2021/11/09/21/50/cat-6782511__340.jpg,Fur Animal Kitten Cat Feline Pet,25,10
https://cdn.pixabay.com/photo/2020/07/07/12/06/murder-5380314__340.jpg,Homicide Forensic Book Murder Cover,35,8
https://cdn.pixabay.com/photo/2022/03/22/01/13/spaghetti-7084156__340.jpg,Delicious Jar Spaghetti,0,0
https://cdn.pixabay.com/photo/2022/02/28/05/03/flower-7038464__340.jpg,Dewdrops Lotus Flower Plant Aquatic,4,2
https://cdn.pixabay.com/photo/2022/01/31/11/32/parakeet-6983359__340.jpg,(optional) description a Add,23,21
https://cdn.pixabay.com/photo/2017/09/26/13/50/rv-2788677__340.jpg,Night Camping Adventure Camper Rv,187,46
https://cdn.pixabay.com/photo/2021/08/22/20/10/hot-air-balloon-6566044__340.jpg,Air Adventure Hot Travel Balloon,13,4
https://cdn.pixabay.com/photo/2016/11/19/11/33/footwear-1838767__340.jpg,Leather Oxfords Footwear Male Shoes,146,28
https://cdn.pixabay.com/photo/2017/08/29/19/14/texture-2694538__340.jpg,Texture Blossom Paper Background,346,44
https://cdn.pixabay.com/photo/2022/03/09/17/42/mountain-7058352__340.jpg,Mountain Nature Season Winter,3,0
https://cdn.pixabay.com/photo/2022/01/22/21/19/bird-6959047__340.jpg,Swamp Lake Bird Wetland Flamingo,6,1
https://cdn.pixabay.com/photo/2022/02/03/10/48/cows-6990194__340.jpg,Cows Cattles Livestocks Farm Animals,28,26
https://cdn.pixabay.com/photo/2020/08/28/12/32/man-5524488__340.jpg,Rain Culture Food Cart Street Man,81,11
https://cdn.pixabay.com/photo/2022/01/18/16/32/fennel-6947467__340.jpg,Produce Vegetables Fennel,20,16
https://cdn.pixabay.com/photo/2018/01/27/13/58/passion-3111247__340.jpg,Cross Passion Friday Good,244,45
https://cdn.pixabay.com/photo/2020/06/10/09/25/anemone-5281964__480.jpg,Flower Plant Blue Anemone Blossoms,152,51
https://cdn.pixabay.com/photo/2022/03/22/03/21/peach-blossom-7084260__340.jpg,Blossom Nature Flower White Peach,2,2
https://cdn.pixabay.com/photo/2021/01/11/17/59/dinosaur-5909154__340.jpg,Dino Dinosaur Animal T-Rex Reptile,21,4
https://cdn.pixabay.com/photo/2019/06/13/16/06/dance-4271941__340.jpg,Dance Traditional Balinese Women,73,20
https://cdn.pixabay.com/photo/2021/09/12/18/42/cat-6619250__340.jpg,Kitty Fur Animal Cat Feline Pet,32,26
https://cdn.pixabay.com/photo/2021/12/06/14/55/christmas-6850542__340.jpg,Christmas Advent Claret Mulled Punch,44,37
https://cdn.pixabay.com/photo/2022/03/10/22/53/bee-7060886__340.jpg,Flowers Persian Insect Bee Speedwell,5,3
https://cdn.pixabay.com/photo/2018/02/12/09/00/the-market-3147758__340.jpg,Fresh Food Grocery Market The Store,134,11
https://cdn.pixabay.com/photo/2022/01/07/02/48/ekaterinburg-6920943__340.jpg,Russia Ekaterinburg City Architecture,6,0
https://cdn.pixabay.com/photo/2022/02/20/02/53/spider-7023630__340.jpg,Spider Cobweb Arachnid Web,9,5
https://cdn.pixabay.com/photo/2022/02/11/13/39/abstract-7007344__340.jpg,Background Abstract Colorful Design,2,0
https://cdn.pixabay.com/photo/2019/10/12/19/14/budgie-4544624__340.jpg,Affection Friendship Budgie Love,142,74
https://cdn.pixabay.com/photo/2018/03/19/11/06/dog-3239718__340.jpg,Little Dog Fun Cute Pet,172,15
https://cdn.pixabay.com/photo/2019/08/12/12/37/landscape-4401120__480.jpg,Storm Landscape Fog Lighthouse Sea,237,85
https://cdn.pixabay.com/photo/2017/06/30/12/10/shipyard-2458150__340.jpg,Tower Worksite Project Crane,120,34
https://cdn.pixabay.com/photo/2020/08/26/15/24/focus-5519780__340.jpg,Focus Inspiration Inspire,24,3
https://cdn.pixabay.com/photo/2019/05/30/12/03/rock-4239769__340.jpg,Balance Spa Meditation Zen Rock,91,8
https://cdn.pixabay.com/photo/2021/11/19/10/30/forest-6808698__340.jpg,Forest Nature Autumn Fall Season,32,25
https://cdn.pixabay.com/photo/2021/11/03/14/00/sunflower-6765941__340.jpg,Der entgegen... Sonne,34,31
https://cdn.pixabay.com/photo/2018/01/20/09/42/sofa-3094153__340.jpg,Wall Sofa Couch Relaxation Furniture,160,27
https://cdn.pixabay.com/photo/2022/03/21/14/12/cars-7083283__340.jpg,Jam Cars Road Traffic,0,0
https://cdn.pixabay.com/photo/2022/03/15/06/38/flowers-7069582__340.jpg,Flowers Botany Bloom Snowdrop,7,5
https://cdn.pixabay.com/photo/2022/03/15/04/13/flower-7069419__340.jpg,Lotus Blossom Flower Bloom Botany,2,0
https://cdn.pixabay.com/photo/2014/08/26/15/31/heartsickness-428103__340.jpg,Lover'S Heartsickness Grief,501,102
https://cdn.pixabay.com/photo/2022/01/30/17/36/dog-6981823__340.jpg,Animal Outdoors Dog Canine Pet,20,0
https://cdn.pixabay.com/photo/2022/02/06/14/05/snowdrop-6997207__340.jpg,Flowers Spring White Snowdrop,12,11
https://cdn.pixabay.com/photo/2022/02/05/18/59/boxer-6995560__340.jpg,Animal Dog Domestic Boxer Pet,11,5
https://cdn.pixabay.com/photo/2016/10/01/18/03/sports-1708051__340.jpg,Lingerie Girl Sports Short Fashion,342,14
https://cdn.pixabay.com/photo/2019/04/07/17/20/chicken-4110208__340.jpg,Chicken Roast Grilled,70,48
https://cdn.pixabay.com/photo/2021/11/07/06/03/animal-6774866__340.jpg,Kitty Mammal Animal Cat Feline,26,21
https://cdn.pixabay.com/photo/2019/11/08/15/34/avenue-4611695__340.jpg,Path Autumn Trees Fall Mood Avenue,164,68
https://cdn.pixabay.com/photo/2019/11/12/14/55/sunflower-4621232__340.jpg,Flower Blossom Sunflower Bloom,207,19
https://cdn.pixabay.com/photo/2018/02/16/19/42/waters-3158413__340.jpg,Rope People Action Waters Flow Move,243,39
https://cdn.pixabay.com/photo/2022/01/30/18/44/mosque-6981927__340.jpg,Praying Islamic Islam Muslim Mosque,0,0
https://cdn.pixabay.com/photo/2021/12/16/08/26/roses-6874117__340.jpg,Rose Bloom Flowers Roses Petals,9,1
https://cdn.pixabay.com/photo/2019/12/29/21/21/big-ben-4728199__340.jpg,Big Tower Ben London Uk Clock,67,15
https://cdn.pixabay.com/photo/2022/03/16/08/31/chess-7071895__340.jpg,Strategy Game King Black Chess,3,2
https://cdn.pixabay.com/photo/2022/03/28/15/01/bird-7097720__340.jpg,Bird Water Lake Comoran,2,1
https://cdn.pixabay.com/photo/2022/03/13/21/33/city-7066875__340.jpg,Barcelona Tourism City Travel,3,0
https://cdn.pixabay.com/photo/2022/03/06/07/13/beach-7050993__340.jpg,Destination Outdoors Sunset Beach,3,0
https://cdn.pixabay.com/photo/2021/12/31/09/34/camellia-6905310__340.jpg,Flower Pink Vegetable Camellia,25,19
https://cdn.pixabay.com/photo/2020/05/08/06/21/nude-5144343__340.jpg,Sensual Nude Erotic Seductive Sexy,108,7
https://cdn.pixabay.com/photo/2019/07/19/03/30/landscape-4347888__480.jpg,Mountains Nature Travel Landscape,122,10
https://cdn.pixabay.com/photo/2020/06/05/02/56/great-spotted-woodpecker-5261220__340.jpg,Great Spotted Woodpecker,101,53
https://cdn.pixabay.com/photo/2022/01/03/10/28/risotto-rice-6912547__340.jpg,Rice Black Risotto,38,34
https://cdn.pixabay.com/photo/2021/08/04/17/48/kingfisher-6522266__340.jpg,Bird Perched Kingfisher Animal,24,5
https://cdn.pixabay.com/photo/2020/04/21/09/48/huangshan-mountains-5072352__340.jpg,Mountains Huangshan Ancient Oriental,23,2
https://cdn.pixabay.com/photo/2022/03/05/18/32/bell-tower-7050004__340.jpg,Sky Tower Clouds Bell Architecture,5,1
https://cdn.pixabay.com/photo/2018/08/17/22/36/m31-3613931__340.jpg,Astronomical M31 Astronomy Space,107,24
https://cdn.pixabay.com/photo/2021/02/20/15/38/pantry-6033796__340.jpg,Glasses Pantry Container In Stock,12,2
https://cdn.pixabay.com/photo/2021/10/18/14/51/mushrooms-6721240__340.jpg,Growth Toadstool Mushrooms Fungus,28,15
https://cdn.pixabay.com/photo/2018/03/15/09/27/moscow-3227572__340.jpg,Night View Air Map Plane Moscow,172,23
https://cdn.pixabay.com/photo/2022/02/04/17/34/bird-6993219__340.jpg,Ornithology Bird Species Chick Rail,15,11
https://cdn.pixabay.com/photo/2022/02/17/05/07/flower-7017957__340.jpg,Lotus Nature Flower Plant Aquatic,18,30
https://cdn.pixabay.com/photo/2020/05/10/18/54/new-york-5155189__340.jpg,York New Landscape City Usa,46,7
https://cdn.pixabay.com/photo/2022/02/21/07/00/couple-7025933__480.jpg,Watching Room Together Couple Dark,1,0
https://cdn.pixabay.com/photo/2021/08/05/15/45/city-6524326__340.jpg,Buildings Lyon City Urban,7,0
https://cdn.pixabay.com/photo/2021/10/15/14/09/saint-marks-basilica-6712670__340.jpg,Basilica Mark'S Saint Italy Venice,36,65
https://cdn.pixabay.com/photo/2022/01/21/06/24/crayfish-6954038__340.jpg,Food Gourmet Meal Crayfish Spicy,22,21
https://cdn.pixabay.com/photo/2021/06/08/01/31/rice-6319366__340.jpg,Sri Cuisine Food Rice Lankan Dish,16,3
https://cdn.pixabay.com/photo/2021/09/03/16/30/clouds-6596175__340.jpg,Nature Atmosphere Sky Clouds Cumulus,11,2
https://cdn.pixabay.com/photo/2021/11/30/01/17/garlic-6834190__340.jpg,Garlic Cloves Of Flavoring,11,4
https://cdn.pixabay.com/photo/2022/04/02/01/23/car-7106012__340.jpg,Driving Car Road Speed Vehicle,0,0
https://cdn.pixabay.com/photo/2021/02/16/02/56/clothes-6019690__340.jpg,Display Retail Clothes Shop Entrance,10,4
https://cdn.pixabay.com/photo/2016/12/04/19/32/strawberry-1882400__340.jpg,Strawberry Milk Splash Berry Fruit,354,44
https://cdn.pixabay.com/photo/2021/07/17/18/55/nature-6473737__340.jpg,Destination Mountain Nature Waterfall,20,1
https://cdn.pixabay.com/photo/2021/12/01/17/48/sea-6838765__340.jpg,Waves Ocean Coast Beach Sea,17,10
https://cdn.pixabay.com/photo/2014/07/11/15/09/unhappy-389944__340.jpg,Face Mask Sad Man Sitting Unhappy,330,68
https://cdn.pixabay.com/photo/2018/02/28/10/05/love-3187623__340.jpg,Pair Two Love Lovers Story,303,23
https://cdn.pixabay.com/photo/2022/02/25/13/41/fly-7034188__340.jpg,Fly Flower Wings Insect Flora,9,8
https://cdn.pixabay.com/photo/2021/10/24/04/57/mountains-6736969__480.jpg,Mountains Adventure Badge Logo,3,2
https://cdn.pixabay.com/photo/2022/02/08/11/21/ocean-7001179__340.jpg,Ocean Water Sunset Beach Travel Sea,6,2
https://cdn.pixabay.com/photo/2022/03/11/05/00/swan-7061185__340.jpg,Water Pond Bird Swan Black,7,12
https://cdn.pixabay.com/photo/2021/09/28/15/20/lion-6664784__340.jpg,Mammal Mane Animal Predator Lion,16,4
https://cdn.pixabay.com/photo/2017/08/05/18/53/mountain-2585069__340.jpg,Mountain Alone Standing Outdoor,203,28
https://cdn.pixabay.com/photo/2021/10/08/17/35/castle-6691933__340.jpg,between style. France) in was Viollet-le-Duc (near neo-Gothic by Hendaye and built Edmond castle The 1879 the Duthoit 1864 Abbadia,30,22
https://cdn.pixabay.com/photo/2016/01/01/13/56/vintage-tv-1116587__340.jpg,Ancient Vintage Transistor Old Tv,213,37
https://cdn.pixabay.com/photo/2016/11/19/11/37/automobile-1838782__340.jpg,Automotive Car Automobile Classic,208,37
https://cdn.pixabay.com/photo/2022/03/08/19/18/waterfall-7056406__340.jpg,Nature Waterfall Sunset Rock Flow,4,0
https://cdn.pixabay.com/photo/2017/08/16/11/39/aurora-borealis-2647474__340.jpg,Aurora Forest Borealis Northern Lights,211,16
https://cdn.pixabay.com/photo/2022/03/08/04/10/flower-7054990__340.jpg,Flower Pink Lotus Plant,7,8
https://cdn.pixabay.com/photo/2021/09/20/22/47/forest-6641993__340.jpg,Forest Path Trees Landscape Fog Man,33,59
https://cdn.pixabay.com/photo/2021/11/24/16/15/mushrooms-6821556__340.jpg,Plants Toadstool Mushrooms Mycology,25,21
https://cdn.pixabay.com/photo/2022/04/01/07/12/pheasant-7104189__340.jpg,Meadow Bird Pheasant Grass Landfowl,1,0
https://cdn.pixabay.com/photo/2020/03/24/12/36/bat-4963918__340.jpg,Covid19 Epidemic Bat Hang,135,64
https://cdn.pixabay.com/photo/2022/02/05/12/42/sea-of-clouds-6994730__480.jpg,Forest Clouds Fog Of Sea,11,9
https://cdn.pixabay.com/photo/2017/03/27/13/51/air-force-2178863__340.jpg,Cargo Air Aircraft Force Plane,153,16
https://cdn.pixabay.com/photo/2021/10/19/15/30/seagull-6723919__340.jpg,Seagull Sand Cliff Lighthouse Sea,44,38
https://cdn.pixabay.com/photo/2016/09/11/13/56/rosemary-1661525__340.jpg,Natural Set Rosemary Collection,289,50
https://cdn.pixabay.com/photo/2017/08/15/08/53/bitcoin-2643159__340.jpg,Bitcoin Currency Cryptocurrency,147,21
https://cdn.pixabay.com/photo/2021/12/12/11/32/mushroom-6864789__340.jpg,Toadstool Plant Mycology Mushroom,26,22
https://cdn.pixabay.com/photo/2019/07/26/10/04/city-4364408__340.jpg,Water Architecture City Building,143,18
https://cdn.pixabay.com/photo/2020/04/04/07/32/raspberries-and-blackberries-5001160__340.jpg,And Blackberries Raspberries,84,16
https://cdn.pixabay.com/photo/2021/08/23/15/08/track-6568030__340.jpg,Track Adventure Transport Travel,17,4
https://cdn.pixabay.com/photo/2022/01/16/20/39/flowers-6943158__340.jpg,Blossom Tulips Bloom Flowers Spring,9,2
https://cdn.pixabay.com/photo/2021/09/25/09/46/dahlia-6654523__340.jpg,Nature Flower Pink Dahlia Garden,55,48
https://cdn.pixabay.com/photo/2018/05/03/05/19/skewer-3370443__340.jpg,Kebab Meat Food Skewer Barbecue,77,10
https://cdn.pixabay.com/photo/2021/07/31/17/14/sushi-6512533__340.jpg,Food Maki Japanese Rolls Sushi,6,0
https://cdn.pixabay.com/photo/2022/01/07/08/00/christmas-6921360__340.jpg,Christmas Tree,41,33
https://cdn.pixabay.com/photo/2021/08/28/09/19/chess-6580492__480.jpg,Chess Entertainment Board Game,7,2
https://cdn.pixabay.com/photo/2017/08/08/14/05/flowers-2611474__340.jpg,Abstract Nature Flowers Art Bouquet,186,33
https://cdn.pixabay.com/photo/2022/03/05/20/14/flower-7050220__340.jpg,Blossom Flower Rose Bloom Botany,9,4
https://cdn.pixabay.com/photo/2019/11/23/05/06/baby-4646299__340.jpg,Korea Seoul Child Happy Korean Baby,120,34
https://cdn.pixabay.com/photo/2019/11/30/03/45/smile-4662474__340.jpg,Teeth Perfect Smile Smiling,78,20
https://cdn.pixabay.com/photo/2016/10/31/18/14/dessert-1786311__340.jpg,Calories Dessert Berries Ice Cream,313,45
https://cdn.pixabay.com/photo/2022/01/29/08/44/eiffel-tower-6976752__340.jpg,Eiffel Tower Monument,6,3
https://cdn.pixabay.com/photo/2021/11/06/18/54/fog-6774111__340.jpg,Path Trees Fall Fog Road Dirt,20,9
https://cdn.pixabay.com/photo/2019/12/15/08/17/closet-4696557__340.jpg,Closet Visualization Design Interior,58,12
https://cdn.pixabay.com/photo/2015/01/08/18/28/startup-593343__340.jpg,Startup Start-Up People,227,43
https://cdn.pixabay.com/photo/2022/02/04/23/41/dog-6993771__340.jpg,Pet Canine Dog Animal,20,1
https://cdn.pixabay.com/photo/2020/01/28/23/22/lingerie-4801267__340.jpg,Girl Lingerie Ass Socks Erotic Se,40,4
https://cdn.pixabay.com/photo/2017/01/26/07/06/fighting-fish-2009972__480.jpg,Fighting Fish Battle Three Color,296,27
https://cdn.pixabay.com/photo/2020/10/10/06/14/security-camera-5642120__340.jpg,Cctv Security Camera,7,1
https://cdn.pixabay.com/photo/2017/01/10/01/32/study-1968077__340.jpg,Studying Study Learn School Education,197,46
https://cdn.pixabay.com/photo/2019/02/24/20/43/mountains-4018476__340.jpg,Mountains Summit Panorama,140,58
https://cdn.pixabay.com/photo/2022/02/05/21/24/man-6995757__340.jpg,Handsome Attire Wedding Man Formal,4,0
https://cdn.pixabay.com/photo/2019/10/21/19/20/alps-4566960__340.jpg,Mountains Landscape Alps Mountain,112,16
https://cdn.pixabay.com/photo/2017/09/21/18/47/model-2772910__340.jpg,Model Necklace Beautiful,226,13
https://cdn.pixabay.com/photo/2022/02/12/15/44/winter-7009228__340.jpg,Snow Winter Mountains Nature,14,15
