Links,Tags,Likes,Comments
https://cdn.pixabay.com/photo/2022/03/23/17/33/bee-7087590__340.jpg,dandelion (Andrena spec.) (Taraxacum minutula group) a mining bee visiting Female mini,3,1
https://cdn.pixabay.com/photo/2015/06/24/14/42/pillows-820149__340.jpg,Sheets Pillows White Home Linen Bed,329,62
https://cdn.pixabay.com/photo/2022/03/22/14/13/umbrellas-7085111__340.jpg,Decoration Display Umbrellas Shade,4,2
https://cdn.pixabay.com/photo/2022/03/20/11/16/horse-7080607__340.jpg,Equine Horse Equestrian Animal,4,1
https://cdn.pixabay.com/photo/2018/06/05/20/23/dragonfly-3456317__340.jpg,Insect Dragonfly Wings Macro,344,108
https://cdn.pixabay.com/photo/2022/03/31/07/12/flower-7102361__340.jpg,Flower Botany Bloom Snowdrop,2,0
https://cdn.pixabay.com/photo/2022/04/02/17/20/river-7107432__340.jpg,Rhine Sunset Trees River,3,2
https://cdn.pixabay.com/photo/2022/01/31/13/25/meal-6983494__340.jpg,Dinner Cuisine Food Lunch Meal Dish,5,1
https://cdn.pixabay.com/photo/2019/04/11/22/29/airport-4120835__340.jpg,People Walking Gate Waiting Airport,115,26
https://cdn.pixabay.com/photo/2016/05/09/10/42/weimaraner-1381186__340.jpg,Snout Puppy Weimaraner Dog,493,59
https://cdn.pixabay.com/photo/2022/02/19/14/36/autumn-7022778__480.jpg,Forest Autumn Woods River,5,2
https://cdn.pixabay.com/photo/2022/02/24/16/34/hut-7032759__340.jpg,Nature Tropical House Hut Kerala,0,0
https://cdn.pixabay.com/photo/2021/08/11/04/52/tissue-6537455__340.jpg,Tissue Manufacture Factory,1,0
https://cdn.pixabay.com/photo/2022/01/08/08/07/dentist-6923507__340.jpg,Dental Orthodontics Equipment Dentist,2,1
https://cdn.pixabay.com/photo/2022/03/23/20/38/bee-7087878__340.jpg,Insect Honey Flower Bee,4,1
https://cdn.pixabay.com/photo/2020/03/10/13/53/flamingos-4919079__340.jpg,Flamingos Bolivia Lagoons Landscape,214,57
https://cdn.pixabay.com/photo/2016/05/13/18/51/wet-girl-1390623__340.jpg,Studio Girl Sexuality In Wet Erotic A,539,28
https://cdn.pixabay.com/photo/2020/03/13/10/36/stairs-4927569__340.jpg,Stairs Architecture Building,47,6
https://cdn.pixabay.com/photo/2022/02/18/07/27/lake-7020123__340.jpg,Angler Eve Lake Sports Boats,18,13
https://cdn.pixabay.com/photo/2022/03/04/22/12/pine-cones-7048072__340.jpg,Trees Pine Spring Cones Garden,8,5
https://cdn.pixabay.com/photo/2016/05/27/22/25/roses-1420719__340.jpg,Pink Rose Roses Blossoms Petals,562,122
https://cdn.pixabay.com/photo/2017/03/12/01/15/nuclear-2136244__340.jpg,Atomic Science Atom Nuclear Bomb,249,52
https://cdn.pixabay.com/photo/2022/03/15/16/20/penguin-7070659__340.jpg,Bird Penguin Nature Animal,10,8
https://cdn.pixabay.com/photo/2018/06/10/13/41/rice-terraces-3466518__340.jpg,Rice Farm Terraces Paddies,196,17
https://cdn.pixabay.com/photo/2021/10/12/03/14/lamp-6702269__480.jpg,Vintage Lamp Lantern Decorative Post,76,74
https://cdn.pixabay.com/photo/2022/02/04/06/08/lotus-6992012__340.jpg,Flower Pink Lotus,25,44
https://cdn.pixabay.com/photo/2016/11/26/23/45/dog-1861839__340.jpg,Dog Labrador Companion Canine Pet,490,68
https://cdn.pixabay.com/photo/2022/03/27/17/58/women-7095742__340.jpg,Outdoors Stairs City Monument Women,3,0
https://cdn.pixabay.com/photo/2022/03/20/04/53/rose-7079964__340.jpg,Flower White Plant Rose,3,1
https://cdn.pixabay.com/photo/2020/03/20/13/13/lost-places-4950624__340.jpg,Places Broken Building Pforphoto Lost,113,19
https://cdn.pixabay.com/photo/2019/02/21/20/03/leaves-4012127__340.jpg,Drops Jungle Leaves Green,158,30
https://cdn.pixabay.com/photo/2022/01/12/15/11/plane-6933118__340.jpg,Aircraft Sky Clouds Plane Flight,30,30
https://cdn.pixabay.com/photo/2016/11/18/15/58/vw-1835506__340.jpg,Forest Car Classic Vw Beetle,228,38
https://cdn.pixabay.com/photo/2020/05/19/06/30/sun-5189430__340.jpg,Sun Sky Morning Sunrise Beach,140,18
https://cdn.pixabay.com/photo/2021/08/26/00/46/bridge-6574734__340.jpg,Bridge Sunset Sky Architecture,36,67
https://cdn.pixabay.com/photo/2022/02/21/06/52/flower-7025911__340.jpg,Flower Murraya Paniculata Flora,8,10
https://cdn.pixabay.com/photo/2022/04/02/20/06/bird-7107662__340.jpg,Hunting Lake Bird Species Cormorant,0,0
https://cdn.pixabay.com/photo/2020/04/17/09/29/fantasy-5054005__340.jpg,Fantastic Fantasy Mood Angel Wing,142,28
https://cdn.pixabay.com/photo/2017/06/27/22/21/banana-2449019__340.jpg,Minimum Banana Fruit Tropical,213,54
https://cdn.pixabay.com/photo/2021/11/11/10/47/architecture-6785972__480.jpg,Europe Belfast City Hall Architecture,10,2
https://cdn.pixabay.com/photo/2022/02/24/18/24/feet-7032931__340.jpg,Barefoot Feet Monochrome Toes,13,10
https://cdn.pixabay.com/photo/2022/01/11/12/33/mask-6930528__340.jpg,Gas Mask Steampunk Halloween,2,1
https://cdn.pixabay.com/photo/2018/05/09/19/29/beech-3385957__340.jpg,Beech Forest Nature Roots Tree,317,34
https://cdn.pixabay.com/photo/2022/03/03/06/26/asters-7044677__340.jpg,Asters Petals Blue Flowers,14,9
https://cdn.pixabay.com/photo/2022/02/06/15/58/mushroom-6997507__340.jpg,Science Russula Fungal Moss Mushroom,24,25
https://cdn.pixabay.com/photo/2022/03/19/15/08/heathers-7078723__340.jpg,Flowers Pink Heathers Plants,4,2
https://cdn.pixabay.com/photo/2022/02/25/07/54/puppet-7033723__340.jpg,bab,11,10
https://cdn.pixabay.com/photo/2022/03/16/17/29/dog-7072897__340.jpg,Chihuahua Dog Canine Monochrome Pet,17,15
https://cdn.pixabay.com/photo/2022/02/17/09/24/geese-7018363__340.jpg,Water Birds Waterfowl Bird Geese,24,23
https://cdn.pixabay.com/photo/2019/07/05/15/07/summer-4318824__340.jpg,Girls Children Summer Little Playing,252,48
https://cdn.pixabay.com/photo/2022/03/04/16/45/crocuses-7047711__340.jpg,Flowers Crocuses Purple,7,5
https://cdn.pixabay.com/photo/2016/05/21/22/15/light-bulbs-1407610__340.jpg,Bulbs Halogen Lamps Light Lights,591,127
https://cdn.pixabay.com/photo/2022/01/09/18/10/corfe-castle-6926607__340.jpg,Castle Forest Corfe Sunset Dorset,8,2
https://cdn.pixabay.com/photo/2022/03/08/17/35/stars-7056241__340.jpg,Milky Way Galaxy Cosmos Space Stars,1,0
https://cdn.pixabay.com/photo/2021/11/21/16/48/winter-6814668__340.jpg,Nature Tree Outdoors Winter Season,34,23
https://cdn.pixabay.com/photo/2020/06/25/02/22/the-night-5338228__480.jpg,Night Nature Moon Home The,208,149
https://cdn.pixabay.com/photo/2022/02/03/00/56/background-6989614__340.jpg,Background Timepiece Watch Time,23,35
https://cdn.pixabay.com/photo/2021/08/18/19/19/buildings-6556381__340.jpg,Kiev Houses Buildings Lane Street,15,4
https://cdn.pixabay.com/photo/2021/08/17/17/28/airport-6553696__340.jpg,Terminal Flight Pass Airport Boarding,5,2
https://cdn.pixabay.com/photo/2017/08/06/11/08/white-2591358__340.jpg,Table White Window Chairs Room,240,49
https://cdn.pixabay.com/photo/2022/01/20/14/14/japanese-camellia-6952395__340.jpg,open culnary camellia tree do in March glossy a Camellia mostly oil produced flowers can Desember seeds japonica evergreen country. cosmetic from our and used found The cold to purposes. Wild species forests It be for not is season fully. very during common leaved,17,10
https://cdn.pixabay.com/photo/2022/04/03/07/33/candle-7108220__340.jpg,Christmas Decoration Candle Light,0,0
https://cdn.pixabay.com/photo/2022/03/24/12/33/coffee-7088958__340.jpg,Morning Soluble Breakfast Coffee,2,0
https://cdn.pixabay.com/photo/2022/01/24/16/48/sheeps-6964004__340.jpg,Sheeps Mammals Live Stock Animals,36,34
https://cdn.pixabay.com/photo/2022/01/13/09/15/tulips-6934766__340.jpg,Flower Spring Tulips Blossom,30,26
https://cdn.pixabay.com/photo/2022/04/03/15/12/nature-7109218__340.jpg,Nature Autumn Fall Leaves Season,4,0
https://cdn.pixabay.com/photo/2020/07/04/14/23/poppies-5369740__340.jpg,Flowers Wheat Poppies Field,235,21
https://cdn.pixabay.com/photo/2022/03/27/15/12/easter-7095384__340.jpg,Flowers Easter Chocolate Bunny,5,3
https://cdn.pixabay.com/photo/2022/01/12/14/56/message-6933083__340.jpg,Message Communication Motivation,29,25
https://cdn.pixabay.com/photo/2022/02/26/18/24/noodles-7036159__480.jpg,Cook Pasta Noodles Dough,4,1
https://cdn.pixabay.com/photo/2022/03/09/00/31/cactus-7056784__340.jpg,Flower Plant Succulent Cactus Flora,10,14
https://cdn.pixabay.com/photo/2019/05/16/23/04/landscape-4208571__340.jpg,Mountains Sailboat Lake Landscape,445,82
https://cdn.pixabay.com/photo/2022/02/16/17/02/bird-7017167__340.jpg,Goose Ornithology Bird Species Fauna,26,2
https://cdn.pixabay.com/photo/2019/11/27/12/37/autumn-4656877__340.jpg,Forest Fall Cup Bench Waldsee,282,45
https://cdn.pixabay.com/photo/2016/11/21/13/30/abstract-1845399__340.jpg,Background Abstract Art Antique,269,49
https://cdn.pixabay.com/photo/2022/01/24/22/05/clouds-6964863__340.jpg,Dusk Sky Thunderstorm Clouds Sunset,32,32
https://cdn.pixabay.com/photo/2021/11/12/23/54/vaccination-certificate-6790266__340.jpg,Coronavirus Certificate Vaccination,6,1
https://cdn.pixabay.com/photo/2022/03/20/15/45/vegetable-7081157__340.jpg,Growth Pumpkin Vegetable Organic,4,4
https://cdn.pixabay.com/photo/2021/01/30/09/59/coffee-5963334__340.jpg,Roasted Beans Coffee,92,17
https://cdn.pixabay.com/photo/2016/11/23/15/08/wooden-floor-1853417__340.jpg,Background Floor Backdrop Wooden,232,44
https://cdn.pixabay.com/photo/2020/08/26/11/57/dog-5519360__340.jpg,Mammal Animal Dog Black Pet,132,46
https://cdn.pixabay.com/photo/2022/02/05/23/06/boats-6995884__340.jpg,Weather Reservoir Lech Boats Flow,13,6
https://cdn.pixabay.com/photo/2022/02/28/18/53/reading-7039859__340.jpg,Reading Book Reciting Islam Mosque,0,0
https://cdn.pixabay.com/photo/2022/03/19/11/48/pussy-willow-7078381__340.jpg,Willow Branch Catkins Pussy,9,13
https://cdn.pixabay.com/photo/2016/11/19/15/32/laptop-1839876__480.jpg,Computer Laptop Cellphone Notebook,257,57
https://cdn.pixabay.com/photo/2021/08/07/06/19/houses-6527892__340.jpg,Homes River Houses Village Buildings,89,24
https://cdn.pixabay.com/photo/2022/02/15/12/47/cloudy-day-7014873__340.jpg,Marsh Weather Clouds Lake Day Cloudy,24,22
https://cdn.pixabay.com/photo/2021/08/18/06/14/girl-washes-the-car-6554716__340.jpg,Girl Machine Car Wash The Washes,39,3
https://cdn.pixabay.com/photo/2018/06/07/09/01/emotions-3459666__340.jpg,Vacations Vacation Clouds Emotions,301,89
https://cdn.pixabay.com/photo/2022/04/08/15/31/sky-7119706__340.jpg,Sky Landscape Cranes City Urban,0,0
https://cdn.pixabay.com/photo/2015/07/30/14/36/hypertension-867855__340.jpg,Blood Hypertension Pressure High,401,216
https://cdn.pixabay.com/photo/2016/11/21/12/59/couch-1845270__340.jpg,Chair Living Room Couch Furniture,244,34
https://cdn.pixabay.com/photo/2018/10/18/00/35/strolling-3755342__340.jpg,Strolling Park Couples Friends,265,98
https://cdn.pixabay.com/photo/2017/07/31/23/45/flowers-2562079__340.jpg,Dandelion Girl Flower Field Child,412,52
https://cdn.pixabay.com/photo/2022/01/26/20/11/aluminum-foil-6969822__340.jpg,Foil Crumpled Aluminum,9,5
https://cdn.pixabay.com/photo/2022/03/31/01/41/flower-7102025__340.jpg,Blossom Flower Bloom Macro Crocus,3,0
https://cdn.pixabay.com/photo/2019/05/29/21/27/home-4238615__340.jpg,Housing Decoration Home Interior,78,14
https://cdn.pixabay.com/photo/2021/11/18/18/07/elderly-6806996__340.jpg,Elderly Forest Trekking Senior Women,6,1
https://cdn.pixabay.com/photo/2018/06/22/02/26/chamomile-3489847__480.jpg,Flowers Chamomile Plant White,315,63
https://cdn.pixabay.com/photo/2022/03/18/15/17/bridge-7076916__340.jpg,Dusk River Bridge Outdoors Sunset,4,2
https://cdn.pixabay.com/photo/2020/06/08/02/51/romantic-5272709__340.jpg,Romantic Full Night Moon,163,98
https://cdn.pixabay.com/photo/2022/03/17/17/41/beach-7075114__340.jpg,Exploration Tourism Beach Travel Sea,4,0
https://cdn.pixabay.com/photo/2022/02/10/06/58/butterfly-7004729__340.jpg,Flower Butterfly Pollination,12,4
https://cdn.pixabay.com/photo/2022/04/03/11/31/nature-7108697__340.jpg,Outdoors Nature Travel Exploration,1,1
https://cdn.pixabay.com/photo/2022/01/13/14/03/mother-6935340__340.jpg,Parent Outdoors Mother Daughter Baby,3,0
https://cdn.pixabay.com/photo/2020/01/30/21/24/rain-4806609__340.jpg,Nature Rain Water Window Drip Wet,109,10
https://cdn.pixabay.com/photo/2022/02/05/23/57/clouds-6995930__340.jpg,Cumulus Nature Clouds Sky,29,18
https://cdn.pixabay.com/photo/2022/03/18/19/07/european-bee-eater-7077256__340.jpg,Bee-Eater Perched Bird European,3,1
https://cdn.pixabay.com/photo/2021/11/16/18/24/facade-6801731__340.jpg,Facade Plastered Wall Plaster,20,9
https://cdn.pixabay.com/photo/2015/11/16/22/44/heart-1046693__340.jpg,Love Sky Heart Red Balloon,484,75
https://cdn.pixabay.com/photo/2022/03/14/16/22/roof-7068490__340.jpg,Tiles Roofing Moss Brick Roof,7,8
https://cdn.pixabay.com/photo/2022/03/01/21/40/flowers-7042123__340.jpg,Flowers Spring Meadow Snowflake,6,2
https://cdn.pixabay.com/photo/2018/12/18/21/40/fantasy-3883115__340.jpg,Fantasy Snow Crow Sculptures Winter,303,25
https://cdn.pixabay.com/photo/2021/08/04/21/15/water-6522645__340.jpg,Water Wallpaper Drops Raindrops,46,51
https://cdn.pixabay.com/photo/2022/03/22/17/33/flowers-7085598__480.jpg,Nature Flowers Spring Macro Garden,2,0
https://cdn.pixabay.com/photo/2022/02/23/18/08/kingfisher-7031149__340.jpg,Bird Perched Kingfisher Animal,9,3
https://cdn.pixabay.com/photo/2022/03/22/07/03/finch-7084436__340.jpg,Plumage Animal Finch Feathers Bird,6,5
https://cdn.pixabay.com/photo/2022/03/19/05/46/buildings-7077912__340.jpg,Buildings City Urban Skyscrapers,8,6
https://cdn.pixabay.com/photo/2021/09/12/09/32/jay-6617822__340.jpg,Birds Feathers Jay Animals Sitting,99,85
https://cdn.pixabay.com/photo/2017/07/24/20/08/farmhouse-2535919__340.jpg,Farmhouse Abandoned Old Farmstead,372,53
https://cdn.pixabay.com/photo/2017/04/27/07/26/rock-climbing-2264698__340.jpg,Rock Free Climbing,177,45
https://cdn.pixabay.com/photo/2015/07/02/10/22/training-828726__340.jpg,Muscles Arms Blonde Training,366,68
https://cdn.pixabay.com/photo/2021/05/27/22/02/astronaut-6289353__340.jpg,Alien Astronaut Space Spaceship Ufo,16,2
https://cdn.pixabay.com/photo/2022/01/26/23/12/dogs-6970234__340.jpg,Mammals Pets Canine Dogs Pet,23,3
https://cdn.pixabay.com/photo/2017/12/05/20/10/pizza-3000285__340.png,Italy Pizza Food,118,15
https://cdn.pixabay.com/photo/2022/02/06/14/06/dog-6997211__340.jpg,Golden Animal Breed Dog Retriever,10,4
https://cdn.pixabay.com/photo/2017/04/28/00/44/egypt-2267089__340.jpg,Egyptian Pyramids Ancient Egypt,236,46
https://cdn.pixabay.com/photo/2022/03/27/14/52/laughing-kookaburra-7095331__340.jpg,Bird Kookaburra Laughing Australia,0,0
https://cdn.pixabay.com/photo/2016/01/02/01/59/oranges-1117628__340.jpg,Trees Grove Oranges Orange Fruits,454,69
https://cdn.pixabay.com/photo/2022/02/16/14/15/polar-lights-7016851__340.jpg,Night Sky Polar Lights Stars,8,0
https://cdn.pixabay.com/photo/2014/12/10/21/01/doctor-563428__340.jpg,Medicine Health Doctor Medical,527,110
https://cdn.pixabay.com/photo/2022/01/08/18/55/valentines-day-6924629__340.jpg,Day Heart Gift Present Valentine'S,43,35
https://cdn.pixabay.com/photo/2020/08/18/21/49/horses-5499465__340.jpg,Field Horses Brown Horse Animals,102,24
https://cdn.pixabay.com/photo/2021/11/08/21/18/candlelight-6780166__340.jpg,is soul....... Each candle a,11,7
https://cdn.pixabay.com/photo/2016/08/26/12/44/houses-1622066__340.jpg,by below ⬇️❤️⬇️ from copying Say the text https://pfüderi.ch thanks attribute. Give a Pfüderi 🙌 Photo to shoutout,279,34
https://cdn.pixabay.com/photo/2022/03/06/15/18/graffiti-7051839__340.jpg,Street Art Wall Graffiti,11,7
https://cdn.pixabay.com/photo/2020/04/22/12/28/book-5077895__340.jpg,Literature Book School A Read,132,45
https://cdn.pixabay.com/photo/2020/07/11/12/47/water-5393919__340.jpg,Drops Background Water Wave Inject,152,17
https://cdn.pixabay.com/photo/2016/06/07/20/20/water-lilies-1442497__340.jpg,flowers lotus,763,141
https://cdn.pixabay.com/photo/2022/03/18/03/27/shelducks-7075820__340.jpg,Animals Shelducks Birds Feathers,4,1
https://cdn.pixabay.com/photo/2022/02/04/11/11/earth-6992537__340.jpg,Planet Galaxy Outer Earth Space,8,1
https://cdn.pixabay.com/photo/2021/11/12/06/59/squirrel-6788170__340.jpg,Squirrel Rodent Foraging Eating,25,13
https://cdn.pixabay.com/photo/2022/03/18/08/25/city-7076099__340.jpg,Urban Buildings City Architecture,2,0
https://cdn.pixabay.com/photo/2022/01/31/13/52/meadow-6983521__340.jpg,Meadow Sunbeams Trees Clouds,34,30
https://cdn.pixabay.com/photo/2022/03/27/13/41/snail-7095173__480.jpg,Mollusc Snail Nature Animal Shell,1,3
https://cdn.pixabay.com/photo/2022/03/10/08/24/hamburg-7059343__340.jpg,Port Ship Hamburg Passenger,8,6
https://cdn.pixabay.com/photo/2020/06/02/00/03/truck-5248809__340.jpg,Truck Delivery Cargo Freight,24,9
https://cdn.pixabay.com/photo/2017/09/14/11/47/sky-2748735__340.jpg,Nature Dusk Sky Clouds Sunset,145,17
https://cdn.pixabay.com/photo/2020/04/14/09/22/lockdown-5041623__340.jpg,Virus Self-Quarantine Lockdown,87,23
https://cdn.pixabay.com/photo/2022/02/22/18/08/duck-7029338__340.jpg,Plumage Male Bird Waterfowl Duck,15,16
https://cdn.pixabay.com/photo/2022/03/05/23/29/crocuses-7050472__340.jpg,Flowers Crocuses Purple,6,3
https://cdn.pixabay.com/photo/2022/03/28/18/41/spring-7098129__340.jpg,Blossom Bloom Flowers Spring Bread,3,2
https://cdn.pixabay.com/photo/2017/12/31/13/49/barn-owl-3052382__340.jpg,Owl Bird Barn Animal,213,18
https://cdn.pixabay.com/photo/2021/11/28/13/17/nature-6830272__340.jpg,krajina jižních v zimní Čechách,12,3
https://cdn.pixabay.com/photo/2021/11/18/05/28/brown-bear-6805509__340.jpg,Bear Predator Brown Animal,20,5
https://cdn.pixabay.com/photo/2021/11/22/12/52/wood-6816499__340.jpg,Wood Bole Logs Firewood,6,4
https://cdn.pixabay.com/photo/2022/03/23/12/25/bird-7087113__340.jpg,Fox Ornithology Bird Species Sparrow,1,1
https://cdn.pixabay.com/photo/2022/02/28/15/28/flowers-7039467__340.jpg,Flowers Wallflower Plants Garden,21,18
https://cdn.pixabay.com/photo/2022/03/09/08/50/okonomiyaki-7057400__480.jpg,you your or mixture “grilling such a “okonomiyaki” seafood. name by as meat ingredients and grilling like” The “cook to batter of Japanese-style made what pancake chopped cabbage liking.” means,11,10
https://cdn.pixabay.com/photo/2022/03/01/22/13/hydrangea-7042162__340.jpg,Hydrangea Flower Plant Leaf Dried,25,21
https://cdn.pixabay.com/photo/2017/11/30/20/37/bible-2989425__340.jpg,Christian Religion Jesus Bible,356,52
https://cdn.pixabay.com/photo/2016/06/24/18/30/businessman-1477601__340.jpg,Businessman Windows Silhouette,295,58
https://cdn.pixabay.com/photo/2022/04/01/03/05/dandelions-7103965__340.jpg,Meadow Wildflowers Dandelions,2,0
https://cdn.pixabay.com/photo/2021/08/20/14/53/wheat-6560622__340.jpg,Sky Field Wheat Clouds,42,21
https://cdn.pixabay.com/photo/2018/07/11/22/18/stomach-3532098__340.jpg,Eating Stomach Diet Dessert Health,169,41
https://cdn.pixabay.com/photo/2022/03/02/21/41/leaves-7044102__340.jpg,Tree Plant Leaves Bud Bush Branch,24,23
https://cdn.pixabay.com/photo/2022/03/23/22/56/black-headed-gull-7088054__340.jpg,Bird Black-Headed Flying Gull,2,2
https://cdn.pixabay.com/photo/2020/06/30/21/53/walking-5357721__340.jpg,Path Walking Senior The Walk,105,78
https://cdn.pixabay.com/photo/2016/11/29/04/18/christmas-1867281__340.jpg,Snow Christmas Balls Baubles,220,27
https://cdn.pixabay.com/photo/2022/03/12/18/59/rock-formation-7064671__340.jpg,Waves Ocean Formation Rock Sea,5,2
https://cdn.pixabay.com/photo/2022/02/09/09/05/flower-7002927__340.jpg,Flower Butterfly Blossom Pollination,29,27
https://cdn.pixabay.com/photo/2021/01/09/21/05/victoria-falls-5903496__340.jpg,Falls Cliff Victoria Waterfalls,33,8
https://cdn.pixabay.com/photo/2022/04/01/15/31/bird-7105039__340.jpg,Goose Ornithology Bird Species Fauna,3,1
https://cdn.pixabay.com/photo/2017/01/29/21/16/nurse-2019420__480.jpg,Medicine Nurse Hospital Doctor,235,59
https://cdn.pixabay.com/photo/2022/01/07/06/54/clock-6921245__340.jpg,Silver Tableware Time Plate Clock,13,10
https://cdn.pixabay.com/photo/2021/10/08/11/33/house-6691124__340.jpg,Interior Design House Apartment,2,0
https://cdn.pixabay.com/photo/2021/06/02/03/37/leaves-6303358__340.jpg,Food Nut Leaves Walnut Almond Fruit,21,3
https://cdn.pixabay.com/photo/2021/11/27/14/56/sparrow-6828242__340.jpg,Perched Animal Feathers Bird Sparrow,52,35
https://cdn.pixabay.com/photo/2021/10/26/06/31/panther-6742755__340.jpg,Animal Big Panther Cats Feline,13,1
https://cdn.pixabay.com/photo/2022/01/01/19/07/pomegranate-6908667__340.jpg,Fresh Food Seeds Pomegranate Fruits,37,45
https://cdn.pixabay.com/photo/2019/09/02/15/58/family-4447538__340.jpg,Outdoors Mother Hugs Daughter Family,113,37
https://cdn.pixabay.com/photo/2022/03/03/15/49/flowers-7045592__340.jpg,Bloom Flowers Botany Daffodil Yellow,17,16
https://cdn.pixabay.com/photo/2022/03/07/04/43/bird-7052925__340.jpg,Bird Species Ornithology Pelican,14,18
https://cdn.pixabay.com/photo/2022/01/17/20/33/cat-6945823__340.jpg,Tabby Animal Ginger Cat Pet,10,3
https://cdn.pixabay.com/photo/2022/01/25/23/37/pillow-6967561__340.jpg,Seat Decoration Pillowcases Pillow,5,1
https://cdn.pixabay.com/photo/2022/03/07/15/59/weather-vane-7054030__340.jpg,Weather Wrought Iron Art Vane,15,12
https://cdn.pixabay.com/photo/2016/12/19/18/21/snowflake-1918794__340.jpg,Winter Mittens Snowflake Season,376,33
https://cdn.pixabay.com/photo/2022/02/05/09/56/mountain-6994422__340.jpg,Mountain Hills Snow Sky Stars,4,1
https://cdn.pixabay.com/photo/2022/03/30/11/42/dog-7101062__340.jpg,Animal Doggy Dog Canine Happy Pet,4,0
https://cdn.pixabay.com/photo/2019/02/10/09/51/photographer-3986846__340.jpg,Taking Photographer Sunset Photos,171,46
https://cdn.pixabay.com/photo/2021/01/27/08/42/gift-5954175__340.jpg,Lay Flat Background Roses Gift,19,3
https://cdn.pixabay.com/photo/2022/02/14/17/36/heather-7013531__340.jpg,Heather Plants Flower Calluna Petals,29,27
https://cdn.pixabay.com/photo/2022/02/25/11/32/demi-mann-7034038__340.jpg,Portrait Demi Mann Actress Swimsuit,4,0
https://cdn.pixabay.com/photo/2021/10/13/08/01/angel-6705736__340.jpg,Christmas Angel Art,30,12
https://cdn.pixabay.com/photo/2022/01/13/07/43/model-6934609__340.jpg,Model Fitness Portrait Heels Pose,15,0
https://cdn.pixabay.com/photo/2022/03/24/10/35/pine-7088830__340.jpg,Nature Pine Needles Macro Branch,2,1
https://cdn.pixabay.com/photo/2021/07/28/10/04/trees-6498776__340.jpg,Forest Trees Woods Rainforest Moss,82,116
https://cdn.pixabay.com/photo/2022/02/10/12/47/fragrant-snowball-7005255__340.jpg,Aufgenommen 5.2.2022 am,31,26
https://cdn.pixabay.com/photo/2019/09/30/15/22/shopping-cart-4516039__340.jpg,Venture Shopping Laptop,45,8
https://cdn.pixabay.com/photo/2022/03/21/06/11/path-7082339__340.jpg,Path Forest Trees Wilderness,2,1
https://cdn.pixabay.com/photo/2017/09/27/01/16/koryaksky-volcano-2790656__340.jpg,Koryaksky Volcano Winter Kamchatka,205,38
https://cdn.pixabay.com/photo/2022/03/26/15/17/cornelian-cherry-7093062__340.jpg,Cherry Branches Cornelian Flowers,2,1
https://cdn.pixabay.com/photo/2022/04/06/15/27/man-7115735__340.jpg,Man Adventure Travel Exploration,0,0
https://cdn.pixabay.com/photo/2022/03/22/17/05/beach-7085530__480.jpg,sunset in Carolina South Myrtle Beautiful Beach,3,0
https://cdn.pixabay.com/photo/2021/07/02/21/18/forest-6382587__340.jpg,Forest Trees Snow Snowy Then Cold,74,100
https://cdn.pixabay.com/photo/2021/01/06/09/13/feet-5893686__340.jpg,Nails Toes Feet Pedicure Toenails,11,5
https://cdn.pixabay.com/photo/2022/03/18/09/11/sunflower-7076203__340.jpg,Flowers Field Sunflower Summer,1,2
https://cdn.pixabay.com/photo/2022/03/08/17/24/desert-7056222__340.jpg,Nature Sand Desert Sunset Dunes,1,0
https://cdn.pixabay.com/photo/2022/03/19/18/59/reed-7079309__340.jpg,Grass Water Stalks Reed,15,19
https://cdn.pixabay.com/photo/2019/05/27/19/08/puppy-4233378__340.jpg,Portrait Dog Cute Puppy Bulldog,170,30
https://cdn.pixabay.com/photo/2018/08/09/10/01/gift-3594129__340.jpg,Gift Christmas Box Present,120,14
https://cdn.pixabay.com/photo/2021/08/15/07/44/clouds-6547108__340.jpg,Sky Clouds Sunset Sunlight Cloudy,74,70
https://cdn.pixabay.com/photo/2021/08/03/18/31/flowers-field-6520171__340.jpg,Meadow Animal Field Flowers Eagle,18,3
https://cdn.pixabay.com/photo/2022/04/05/20/29/lion-7114384__340.jpg,Mammal Animal Wildlife Feline Lion,1,0
https://cdn.pixabay.com/photo/2020/10/19/16/36/women-5668258__340.jpg,Models Ocean Sand Beach Women,63,4
https://cdn.pixabay.com/photo/2017/09/07/15/30/hdr-2725661__340.jpg,Hdr Destroyed Old Area Factory,206,25
https://cdn.pixabay.com/photo/2019/07/22/15/19/new-zealand-4355349__340.jpg,Night Zealand New Moon Lights Stars,145,33
https://cdn.pixabay.com/photo/2020/02/05/19/50/summer-palace-4822213__340.jpg,Heaven Summer China Beijing Palace,45,9
https://cdn.pixabay.com/photo/2021/10/21/07/36/human-anatomy-6728232__340.jpg,Human Nervous Anatomy System Biology,11,3
https://cdn.pixabay.com/photo/2022/01/21/10/56/cherry-blossom-6954492__480.jpg,Cherry Pistil Blossom Stamen Flower,43,37
https://cdn.pixabay.com/photo/2022/03/28/16/01/transport-7097884__340.jpg,Perspective Transport Urban City,1,0
https://cdn.pixabay.com/photo/2021/12/22/02/56/interior-6886566__340.jpg,Table Interior Home Sofa Furniture,6,1
https://cdn.pixabay.com/photo/2020/08/19/17/44/buzzard-5501613__340.jpg,Bird Desert Buzzard Animal,184,133
https://cdn.pixabay.com/photo/2018/04/05/15/01/sakura-3293045__340.jpg,Flowers Blossoms Cherry Sakura,160,25
https://cdn.pixabay.com/photo/2017/02/06/11/58/desert-2042738__340.jpg,Pattern Waves Sand Desert Dunes,333,45
https://cdn.pixabay.com/photo/2022/03/04/20/56/city-7048003__340.jpg,Chicago Buildings City Architecture,2,1
https://cdn.pixabay.com/photo/2013/05/17/07/12/elephant-111695__340.jpg,Zoo Elephant Animal,638,111
https://cdn.pixabay.com/photo/2021/09/08/18/37/alley-6607647__340.jpg,France Alley Architecture South,14,2
https://cdn.pixabay.com/photo/2022/03/24/15/25/flower-7089264__340.jpg,Blossom Flower Bloom Spring Crocus,1,0
https://cdn.pixabay.com/photo/2019/10/13/12/35/paris-4546007__340.jpg,Paris Montmartre City France Travel,142,25
